ID,STORE,LABEL,SCORE,YEAR,MONTH,DAY,CONTENTS
22751,구글,복합,5,2019,10,25,별 5개 줄수도있는데 제가 이게임을 하면서 정말재밌고 좋았는데 게임을하면서 매칭이되고나서 플레이 했더니 저는 트로피가 7845개인데 상대팀은 전부 트로피가 10000개가 넘어요 그래서 올라가는 트로피보다 사라지는 트로피가 더많아요 그래서 계속 저는 7800~7900을 내려갔다 올라갔다를 반복하고있어 너무힘들고 조금씩 짜증이나요 브롤스타즈 를 만든 슈퍼셀과 제작자들 운영자들이 외국인이라서 제글을 못 읽을수도 있지만 제발좀 이런글좀 번역해서 읽어주세요 날마다 브롤러 추가하고 업데이트하는것 마다 좋지만 매칭도 중요하니깐 매칭좀 업데이트시켜주세요 요약을 하자면 1.상대팀이 전부 고인물로 매칭돼서 너무힘들다 2.이런 시스템 때문에 트로피가 올라가지를 않는다 3.이런글좀 읽고 매칭시스템을 업데이트를 시켜줘라 이렇게 요약을하니깐 업데이트가 하기가 정말 쉽잖아요 제발 부탁드립니다 계속 이런걸 방치 시키면 고인물과 썩은물때문에 초보자나 중수들이 못할수밖에 없어요
23101,구글,부정,5,2019,10,29,이런 망겜을 봤나 아니 슈퍼셀게임은 다 이따구인가요? 현질해서 레벨빨만있고 현질 했어도 에너지드링크모드에서는 레벨이 상관이 없어요? 그럴거면 레벨없에고 걍 에너지 드링크모드나 하든가요.그리고 20랭크 힘들게 찍어도 시즌 종료되서 쉘리 700점 갔다가 600점 되고 쓉 망겜이네 그나마 축구를 좋아해서 브롤볼을 해도 새끼들이 자채골이나 넣고 그리고 시즈는 그냥 삭제되도 됩니다 개노잼이니깐요. 그리고 잼그램도 메인맵인데 재일 재미없어요.망할놈에 게임
23108,구글,복합,5,2019,11,3,"시작할때트로피를어떻게많이모으는지궁금했는데몇판해보니모으기쉽네요그리고몇일전에샌디가나왔는데보석700개가너무비싸요 조금만깍아주시면감사감사 그리고저스파이크저번에뽑아서너무기쁨니다 전설확률도괜찮네요! 그런데바운티,젬그렙이너무어려워요 그리고보석이너무얻기가힘들어서보석확률을좀올려주세요~~그리고저불20랭크됐어요!"
23113,구글,부정,5,2019,10,30,모바일 게임 중에서도 갓겜이다..손쉬운 게임 방식이지만 전략적인 게임 언젠간 이 게임도 질리겠지만 매우 재밌는 게임이다 단점이라 하면 게임 목표에 파격적인 것이 부족하고 서버가 적고 게임플래이가 네트워크에 가까워도 원활하지 못한 점이다 (일명 레드와이파이)요즈음에는 벨런스 붕괴캐릭터(콜트보다 더 강한 8비트 같은)가 속출해서 많이 아쉽다 이런 단점과 장점이 극과극이라서 많은 유저가 떠나고 있다
22004,구글,부정,5,2019,10,26,저기요 진짜 너무하시네요.저 상자 진짜 오래동안 모아서 전설 브롤러 한 명만 나오길 바랬는데 이게 안 나오네요.그리고 여기에 리뷰 다신 분들 의견은 좀 들어주시나요?안 들으시는 거죠?하...실망이네요.업데이트만 새로운거 계속 만들지마시고 기본적인 걸 좀 수정하세요. 일하기 싫으셔서 혹시 이렉 만드신건가요?결론적으로 브롤러 확율 높이시고 렉 좀 없에세요.이렇게 까지 말하게 하실줄은 몰랐네요.좀 실망이네요.제발 제 의견 좀 봐주시고 수정 부탁드려요.제발요.제 의견대로 수정해주시면 진짜 최고의 게임이 될 것 같습니다.그리고 한국어 알아들으시는 것 맞으시죠?알아들으시면 제발 수정해주세요.브롤러 확율 높이시는 것 잊지마시고요.기분이 오늘 많이 상했네요.참..마지막으로 한 번만 더 수정 부탁드립니다. 감사합니다.
22369,구글,부정,5,2019,11,2,제가브롤을6월달부터재밌게게임중인데레드와이파이나게임로딩이100%로라고배경화면에나와도게임에안들어가져서트로피가자꾸떨어져서짜증납니다.이점만고쳐주시면정말감사하겠습니다.그리고흡혈모드처럼일반쇼다도상대잡으면비가차면좋을것같아요왜냐면1명짜르면피가반피도안남는데얘들이3명정도가잡을려고계속길을막고피도못채우게해서짜증나고특히레드와이파이땜에죽었는데인성질하는얘들은더짜증나고또브롤볼할때배그처럼신고하면플레이영상보고진짜정지를해주시면좋겠습니다
22386,구글,긍정,5,2019,11,21,브롤스타즈 짱!짱! 항상 스트레스를 풀어주구 짱입니다. 그리고 트로피쭉쭉ㅎㅎ 게임중에서 2번째로 재일재미있음. 항상화이팅하시고 이악풀러들아 이게임 만드는데 얼마나 힘들고 오래걸리는지알아? 님들이 만들어보셈 얼마나 힘든지 슈퍼셀 화이팅! 게임 너무좋아요. 안깔아본분들 다운로드해보세요. 진짜재미있어요 깔아도후회안합니다. ㅎㅎ 슈퍼셀화이팅!!❤❤ 그리고 제 댓글 봐주세요. 슈퍼셀 화이팅!!!!!!❤❤❤
22758,구글,부정,5,2019,10,31,"게임 자체는 재밌긴한데 트로피 만개넘었는데 영웅급 팸,프랭크 2개 신화급 진 1개가 끝임.. 브롤러 졸라안나오고 코인이 너무 적고 충전이 느려서 다들 몇판하다 코인충전된거 끝나면 안해서인지 동시접속자가 좀 적은느낌.. 좀비캐릭도 좀 있는듯. 타인폰으로 몇판하는데 접속도 안한 내 아이디랑 같은편됨"
22763,구글,복합,5,2019,10,24,아니....제가 잼그랩을하고있었는데 졌어요.근데 전투기록을보니까 상대편은 다 200이상의 트로피에다 파워 10까지 있고 저희팀은 전부다 1렙어다 전부다 100이하입니다. 말이되나요?? 10랭크 이하의 팀과 vs 13랭크 이상인 팀이 싸우면 누가 이기겠어요??당근 상대편이 이기죠. 이번 업데이트 진짜 잘돼서 신나게하고 있는데 이점만 좀 제발 고쳐주세요ㅠㅠ
22767,구글,부정,5,2019,11,5,브롤이 빨리 패치 해야하는 것 1.엠즈 너프하기 벨런스 붕괴되서 궁 지속시간이나 슬로우효과 스타파워로 바꿔야하고 사정거리 은근히 긴데 판정도 개좋아서 너프해야함 2.레드와이파이 유선으로 연결시킨 컴퓨터로 플레이하는데 이유없이 레드와이파이뜨면서 렉걸림 서버를 여러개로 만들어야 한다 생각함 3.신고기능 브롤하면서 젤 불편한건데 같이 채팅친애 말고는 신고가 불가능해서 쇼다운말고 브롤볼이나 젬그렙에서 트롤짓하면서 패작하는애들을 못막음 신고기능은 모든게임에 반드시있어야 게임에 트롤이 줄어들수있어서 반드시 넣어야함 4.레벨차이 트로피 100대 애들이 스타파워 갖고있을때 이번 게임 플레이할때 벨런스 붕괴로 이어짐 플레이할떄 레벨에 비례해서 매칭하는 시스템 넣어야함 일단 오늘은 생각나는것 썻고 다음에 다시쓸때 더 추가해서 브롤 욕할꺼다.
23134,구글,복합,5,2019,10,31,너무 재미있고 브롤러도 다양해서 좋은데 조이스틱이 제멋대로움직여서 공격버튼도 않눌러질때도있음. 내폰만 그런건지는 모르겠는데 버그면은 고쳐주셈.
22395,구글,부정,5,2019,11,1,재밌긴한데 하면 할수록 진짜 겁나 짜증납니다. 브롤러가 트로피가 많으면 트로피 겁나 많이 깎여 가지고 2번 이기고 1번꼴찌 해도 진짜 겁나 짜증나요. 트로피좀 적당히 깎아주세요. 어떨때는 진짜 브롤스타즈 지워 버릴까 정도로 짜증 났어요.
22782,구글,부정,5,2019,10,26,안녕하세요. 저는 무과금 플레이어 인데요. 지금 상자에서 캐릭터가 나오고 난 뒤인데요 지금 정말로 거짓말 1도 섞지 않고 두달째 캐릭터가 나오지 않습니다;; 언제는 한번 대형상자 2개 브롤상자 12가 있었어요 대형상자 중 하나는 스타토큰으로 얻은 것이고 하나는 보석이 31개가 있어 대형상자 2개와 저의 인내심으로 모은 브롤상자 12개를 깠어요. 먼저 브롤상자를 다 깠어요 예상했지만 역시 나오지 않았어요. 그래도 대형상자를 믿고 나머지 2개를 깠죠 역시 나오지 않았습니다. 그리고 오늘도 대형상자 1개와 브롤 상자 5개를 깠어요. 오늘도 안나왔어요. 계속해서 점점 이렇게 브롤러 확률이 낮아지는 것 같아요. 확률이 높이지지 않는다면 상자 까는 재미와 더불어 브롤스타즈를 하는 재미 마저도 없어질것 같네요. 지금 이 기분으론 별 1개 주기도 싫습니다; 확률좀 많이 높여주세요ㅋㅋ 어떻게 대형 2개랑 일반 1ㅈ개에서 하나도 안나옵니까;ㅋ 확률좀 높여 줘요; 업데이트를 할 날을 기다립니다.
23143,구글,부정,5,2019,11,13,"원래 트로피가 4000 이였는데 폰을 바꾸고 똑같은 계정으로 들어갔는데 121트로피로 바뀌있고 브롤러도 20 몆명이였는데 4으로 줄어져있었고요, 원래 닉네임도 김우짱이였는데 우짱으로 닉네임이 바뀠어요...."
22418,구글,복합,5,2019,10,26,게임 플레이 할때는 좋고 재밌는데 레드와이파이가 와이파이 빵빵 할때도 레드 와이파이가 떠서 좀 불편하구요.. 브롤러를 뽑기위해 현질을 하고 상자를 모아서 까는데도 신브롤러 하나가 안나와요 그래서 신브롤러 나오는 확률을 0.1104% 이런식으로 말고 평균 10%로 높혀주면 이 게임은 늙은이가 돼도 재밌어 플레이할 게임 같아요.. 제발 확률을 높혀주세요 최소 5%정도......
22806,구글,부정,5,2019,11,9,아닛..ㅋ신규브롤러가 ㅋㅋ 트로피 6400인데 (현재기준) 영웅 2개 실화입니까? 하 어이가 없었서 이거 제발좀!! 고처주세요 확실이 진짜 이건좀 아니잖아요!! 한마디로 신규 브롤러가 조금더 잘나오게 패치하고 파이퍼 너무 사기에요 너프 시키거나 없에는건 좀 아니지만 벨런스가 너무 ㅋㅋ 사기잖아요 그건많 아니면 5점도 아닌 100아님 1000점도 줄수있지 이거 아니면 5점은 모자람 ㅋ
22808,구글,복합,5,2019,10,27,캐릭터 너무좋아요그런데부탁이있습니다대형사장와 일반상자를 동시에 누르니까일반상자가까지더니 대형상자는 사라졌습니다. 복구를 부탁드립니다. 아니면 버그를 수정이라도 해주시기 바랍니다. 부탁드립니다.
23164,구글,복합,5,2019,11,9,이거 렉이안걸리고 예전에는 안돼고 튕기고 서버걸리고 했는데 업테이트하면 렉도 안걸리고 잘돼고 안튕기고 서버 안걸리고해서 너무너무 재미있어요.😊😊😃😃😃😂😂😂 트로피도 순식간에 올리고 8012트로피가 있어 그걸로 엠즈 뽑고 상자게속 까서 진짜 기분이 넘나넘나 좋아요.😂😊😊😊😊😊😊😊😊😊😊😊😊😊😊그런데......파워플레이는 스타파워 있는 브롤러만 되네요. 레벨도 15인가 14인가 만들어주세요 그러면 제가 기분이 좋을것 같아요 . 그리고 초특수스킬 도 만드시면 제가 바로 상자100개 까서 뽑을게요 제가 기운을 드릴게요😊😊😊😊😊😊😊😊😊😊😊😊😊😊😊😊😊😊😊😊😊😊😊😊😊😊😊😊😊😊😊😊😊제가 게임 렉걸리는 게임도 좋아하는데 렉이 안걸리는 게임이 더재미있어요 상자도 보석으로사고 포인트로 사고 토큰과 스타토큰도 얻어요. 슈퍼셀님 너무너무 사랑하고 감사해요. 그리고 이 편지 받고 힘내세요.♡♡♡♡♡♡
23166,구글,부정,5,2019,11,9,"안녕하세요. 브롤스타즈를 재밌게 플래이 하는유저입니다. 새로운기능으로 클럽에서 보석,코인을따로 선물하는 기능이있으면 좋겠어요. 왜냐하면 전 무과금으로 힘들게 얻는데 전 브롤러가6달째안나와요. 아니면그냥 기능을 일요일만 되도괜찮아요. 그러니 그렇게해주셨음 좋겠어요. 좋은게임 만들어주셔서 감사합니다. 슈퍼셀 응원해요!!"
23169,구글,부정,5,2019,11,16,레드와이파이 걸리면 공격이랑 이동이 롤백되듯이 뒤로 돌아갔다가 난리치는데 왜 내 피는 롤백 안될까요? 그 이유를 곰곰히 생각해봤는데 그냥 브롤이 망겜 서비스 종로해야할 1순위 게임이기 때문이에요
22077,구글,부정,5,2019,10,30,거미가 줄을타고 올라갑니다~ 거미가 줄을타고 내려갑니다~ 트로피가 계속해서 내려갑니다~ 트로피가 계속해서 높아집니다~ 그러나~~ 브롤러 트로피 548점때~ 트로피가 줄을타고 530까지 내려갑니다~ 이것을 3번정도 반복합니다~ 20분간 트로피를 못올렸구나~
22441,구글,부정,5,2019,11,20,진짜 이거봐야합니다. 사람들이 브롤 재밌다고하니까 게임이 완벽하게 잘만들어진줄알고 계속 안고치는데 진짜 심각합니다. 티밍도 지금 점점 떠오르기시작했고 레드와이파이도 심각합니다. 티밍을 못하게 막을 방법이 없는건 아는데 그래도 최대한의 노력을 해주시면 좋겠습니다.에너지 드링크나 치유버섯 나오는 맵빼고는 티밍이 좀 보입니다.그것 말고 다른 방법도 생각하셔서 도입해주시고 서버렉이 걸리지않게 서버를 따로 나누던가 해야할 것같습니다.예전도 그렇고 지금도 그렇고 티밍과 와이파이 렉때문에 많은 사람이 고통받고 브롤스타즈를 접었습니다. 최대한 빠르게 고쳐주시면 좋겠습니다.
22446,구글,긍정,5,2019,11,6,브롤 너무 재미있어요!원래 다른 캐릭터들은 예쁘거나 귀여운 맛에 현질 하는데 캐릭터는 이쁘고 귀여운 데다가 공격력 까지다르고 그레서 현질 할 수 밖게 없어요ㅠㅠ 요즈음 새로나온 할로원 쉘리도 너무 귀여워요ㅠ 그리고 요즈음 새로운 캐릭터 까지많아 나와서 너무 좋아요!!슈퍼쉘님!새로운 캐릭터도 많이 만들어 주세요!!!별5개로는 부족해요! 드릴수 있으면 더들있수 있는데.....한99999999999999999999999999999999999999999999999999999×(무한)개 드릴수 있어요!브롤 재미있어요!!그리고 수정은 레드와이파이 좀 없에주세요!아니 와이파이 빵빵 터지는 곳에서했는데 레드와이파이가 터져요ㅠ 이점 고쳐주세요!그럼 이만!!!!
22447,구글,부정,5,2019,11,13,아니 무슨 게임이 이래 ! 내가 와이파이 끝고 데이터 끝고 했는데 외! 렉이 걸리냐고! 재가 클로도 그렇고 붐비치를 하는데 진짜 망게임을 만들려고 하나요? 진짜 게임 하면 스트레스 쌓인다 그냥 게임 만들지마 똥퍼셀아! 레온 만든사람 해고시켜요!! 아 최악의 게임이야!!!외국 놈들은 게임 외캐 못만들어 댓글 잃어!! 그리고 티밍하지마 치사한 놈 들아
22824,구글,복합,5,2019,11,17,안녕하세요.7000데유저입니다.다좋은데문제점들이있어요1.레드와이파이고치고(거의대부분유저들이가장고통스러워하는거임) 2.몆몆캐릭말고대회에서거의안씀(벨런스문제임) 3.목소리안어울리는캐릭터들목소리변경 4.신캐확율올리기(전상자50개1달반동안모는거다깠는데도불구하고아무것도안나옴) 5.자신이모은파워큐브자신이먹을수있게변경 6.트롤러들신고기능만들어놓기 그럼정말로좋겠네요슈퍼셀화이팅!!!!
22830,구글,복합,5,2019,11,2,게임이 재미는 있습니다만 별 2개가 부족한 이유는 신규브롤러 왜이렇게 안나옵니까? 확률조작 아닙니까? 제가 상자를 얼마나 많이깠는데 영웅브롤러 부터 안나옵니까? 이게 말이 됩니까? 제가 현재 5000점댄데 2000점대에 16개의 브롤러를 모았는데 3000점 올릴때 까지 신규브롤러가 안나오는게 말이 안됍니다
22831,구글,부정,5,2019,11,2,"아니..;;;;;;기것 트로피 열심히 올려놨드만 왜 깍아요ㅋㅋ6000대였는데 5000대됬어요 하...지울깨요 와..진짜 힘들께 올렸는데,... 스킨 안사도 되고스킨 필요없거든요 제발 트로 피 안 깍이게 해주세요.하...진짜 노 잼이다 제 친구들도 트로피 깍인다고 다 브롤 지웠거든요,걍 지울깨욥..시즌 끝나는거 진짜 싫거든욬 그럴꺼면 게임 왜 해요.ㅋㅋ 그리고 브롤러는 1도 안나오니까 레벨 이 높은거 밖에 없으니까 한판 지면 겁나 많이 깍여요.노잼임"
22833,구글,부정,5,2019,10,29,친구랑 게임을 하는데 너무 랙이 많이 걸려 친구와 게임이 어려워졌어요. 그리고 요줌에 신규 캐릭터는 왜 포코 공격이랑 비슷한 것 같네요. 스타파워 코인을 깎아 주세요.
23183,구글,복합,5,2019,10,24,솔직히 게임 진짜 잘 만듬 다좋고 진짜진짜 다좋은데 레드와이파이진짜 너무심함 내가 게임을 하는건지 사진을 보는건지 구분이 잘 안감 슈퍼셀님들 브롤러 스킨같은거 내지말고 이 문제좀 고쳐주세여 정.말.착.한.슈.퍼.셀.님.들!!!
23188,구글,부정,5,2019,11,2,제가 12400점이에요. 500점 스파이크 들었더니 2700점에 79점인 다이너랑 매칭되었네요. 매칭시스템 상태가 심각한것 같으니 다음패치에서 수정해주시면 감사하겠습니다.
22093,구글,부정,5,2019,11,3,"게임은 재밌으나 렉이 많이 심하고 (그지같은 레드 와이파이) 빅 브롤러는 제시가 너무 사기임 제시만 걸리면 잡기가 너무 어려움 그리고 매칭 시스템도 별로고 캐릭터 확률도 적어서 안좋다. 오랬동안 안나오면 확률이 올라가지만 그 올라가는 확률도 엄청적고, 그것때문에 잘나오지도않는다. 그리고 가끔씩 트롤러들도 보이는데, 신고 기능을 만들든지 해서 트롤러들을 잡아줬으면 좋겠다. 그리고 스킨 가격도 비싼것 같지만 게임에 직접적으로 영향을 주지는 않으니 상관없으므로 넘어간다. 그리고 시즌 끝날때 트로피 떨어지는 건 떨어지는 양을 줄였으면 좋겠다. 트로피가 쭉떨어져서 랭크 올리기가 너무힘들다."
22101,구글,복합,5,2019,11,3,재미있는 게임입니다. 1년동안 꾸준히 하고 있습니다. 하지만 가장 큰 문제는 같은 팀이 된 브롤러 신고기능이 없다는것 같네요. 트롤짓 하는 브롤러가 갈수록 많아집니다. 너무 재미있는데 이런 유저들 때문에 화가 나서 게임을 접고 싶어지네요. 신고기능으로 너무 많은 신고를 받은 유저에게 불이익이 있어야한다고 생각합니다.
22102,구글,복합,5,2019,11,10,"좋은데...... 상자 확률만높여주면안돼나요?... 제가 전설1개도없어서그런데....... 상자 확률 좀 높여주세요. 제 친구들중에 저만 전설이 없습니다..... 그리고 브롤러pp얻을때 좀 많이주시고요,트로피가 너무 많이 깎여서 점수올리기 힘듭니다. 트로피를 적게 깎아주세요."
22467,구글,복합,5,2019,11,2,"아주 좋습니다. 브롤 싸움도 좋고 다좋지만 캐릭터사 브롤 상자에서 안나올 때 는 신규브롤러도 얻어야지 세로운데 안얻어 져서 너무 지겹습니다.ㅠㅠ 조금 더 브롤 상저에서 신규브롤러 황률 높여 주세요. 그런데 솔직히 말하자면 처음에 이 게임이 어려웠고 재미없어서 지웠다 깔았다 했는데 하다보니 전투도 대미있고 캐릭터,스킨 었는 재미가 있어 계속 이 게임을 하게 되었습니다. 다른 분 들도 참고 해보시면 재밌을 거 에용~ ㅎㅎ 브롤 스타즈가 더 발전 해 인기를 얻었으면 좋겠고요 앞으로도 이 게임이 계속 있었으면 좋겠습니당~ 브롤 스타즈 화이팅 하시고 나중에 만나용~~~~ 감사합니당~^^"
22472,구글,복합,5,2019,11,11,아니 원거리만 출시되고 점점브롤러들 패시브상향시키는건 좋은데 그럴꺼면 근접 엘프리모같은 놈들은 벽너머에있는놈들한테맞고 궁개이지채우가만할꺼면 따로 근접전용 맵을 처만들던가 아무것도안하고 해봣자 체력 그런것만 만들고 다른 원거리브롤러들 만계속좋은 스팩으로 만들면 어쩌자는 거냐 밸런스를 생각하고 게임을 운영해야지 이딴댓글안나오게 위견수용을 좀만하면 해결책이 보일텐데 제작자 생각1도 안하네 ㅂㄹ들이;
22473,구글,부정,5,2019,11,1,슈퍼셀 아이디연동했는데 기기변경 할때 계정 을 안전하게 이동한다고되어있는데 기기변경 후 게임하려면 전기기 에서 로그아웃 해야하는거 실화 전기기가 화면이 않나와서 로그아웃을 하수도없는데 슈퍼셀 아이디연동 하라고 왜말한거임? 이게임 하는사람들 슈퍼셀 아이디연동 했으면지금당장 로그아웃 하삼
22847,구글,부정,5,2019,11,19,"이 게임의 만족도는 별 2개입니다 별 2개인 이유는 슈퍼셀이 서버를 안늘려서,보스전 패치가 너무 어렵게 되서,대릴 궁버그,브롤 볼 판정오류 등 문제가 많기 때문에 별 2개도 사실 과하다고 봅니다"
22850,구글,부정,5,2019,11,21,제발 레드 와이파이랑 트롤러 신고 좀 하게 신고 기능 좀 넣어주세요! 진짜 하다가 화가 나는 게임은 오랫만이네요! 브롤러가 제일 심한데... 거기서 같은 편 한명이 일부로 안움직인다거나 아니면 골을 가져가 자살골 넣습니다. 10판 5판은 무조건 저렇고요 아이디 보면 한국인 아니면 중국인 그중에 7할이 중국인ㅡㅡ 진짜 신고해서 계정 정지 먹이고 싶음ㅡㅡ 거기에 티밍... 이게 쇼다운인지 티밍지옥인지ㅎㅎ
22861,구글,부정,5,2019,11,16,"진짜 짜증나..별 1개도 아까워 진짜 슈퍼셀 망해라!! 내가 문의릉 하면 실제로 읽으면 좋겠어.. 맨날 버그만 생기고.. 맨날 지고 우리팀은 계속 다 못하고 상대팀은 다 만렙이고 진짜 개똥퍼셀 개 싫어... 티밍은 한 방법이라 하고 레알 슈퍼셀 미쳤음.. 레드 와파도 겁나 심하고 진짜 빡침. 이거 진짜 깔지마세요.. 지금 트로피 600이상에서 돌리면 계속 지고 너무 트로피도 많이 뺏기고 신규 블롤러 같은거 만들시간에 버그나 고쳐라.. 인생 살면서 제일 싫은 게임임.. 스트레스 풀려고 게임 하는데 스트레스만 더 쌓임...지금 재밌다고 하시는분 트로피 올라가면 빡쳐서 100% 지웁니다.. 진짜 똥퍼셀 인성,버그 설명하려면 하루해도 모자름.. 이 게임 정말 비추천입니다.. 시간 아까워요.. 1시간 동안 브롤 하고 트로피보면 10개 밖에 안 올라가있고... 계속 캐릭터도 안주고진짜 똥퍼셀 개싫음.. 여러분 이 게임 진짜 깔지마세요... 진짜 슈퍼셀 적당히 해야지 진짜 똥퍼셀 비추천개짜증ㅗ"
23204,구글,복합,5,2019,10,27,너무 재밌어요~~!!♡ 진짜 브롤에서 벗어날려고 해도 계속생각나는 그게임~~!! ㅜㅜ 음 근데 친선게임에서 트로피를 주는 친선게임도 있었으면 좋겠어요!!ㅎㅎ 이게임 완전 오래했는데 저는 아직 브롤러도 별로 없네요..ㅎ..하하.. 브롤러 뜨는확륙을 조금만 높여주세요우오ㅜㅜㅜㅜ 너무너무 재밌어서 정말 감사한다는 말! 전해주고 싶었어요!! 항상 재밌는게임으로 업데이트 해주세요~~!ㅎㅎ
23208,구글,부정,5,2019,10,25,너무 재미있게 하고 있는데요 상어레온 부터 왜 세일을 않하시는 거죠? 돈이 필요한건 알겠는데 웨어울프 레온 사려고 옜날에 세일하면 109 보석 이니까 그만큼 모았는데 마녀 쉘리가 세일을 않해서 불안감이 밀려옵니다 현질도 못하는데 제발 웨어울프 레온만은 세일해 주시면 않될까요?ㅠㅠ
23210,구글,부정,5,2019,10,25,운영자야 이건 아니지 레온 목소리도 이상하고 8비트나 엠즈같은 경우는 초보자들은 뭘 쓰라는거야 미친거아니냐 솔찍히8000개는 에바다...그럴거면 트로피을 얻기 쉽게하든가 쇼다운에서 1등한다고10개로 되나 참 어이가 없네 진짜쫌 트로피 친척ㄱ도 높게 하면않됨??
23211,구글,부정,5,2019,11,18,아니 크레에이터 는 보석.15펙 살수있지만 저희 는 부모님이 안사주시잖아요 그리고 브롤러이상하게 나와요 트로피 친척도가 브롤상자에서 나오잖아요 한번만더 그러면 삭제 할꺼에요! 그리고이 게임 별1개에요 알았나요?
