ID,STORE,LABEL,SCORE,YEAR,MONTH,DAY,CONTENTS
22649,구글,부정,5,2019,11,10,아니 무슨 팀매칭을 이렇게 해줘요? 젬그램을 했는데 저희 팀에는 스타파워가 있고 상대편은 다 스타파워가 있고요 버섯치유도 혼자있을때 나온다고 하셨는데 제 쪽에는 한번도 않나왔어요!저혼자 독가스 않에 있었는데!! 그것때매 트로피도 겁나많이 빼꼈고요! 제발 싸우는 도중에 채팅창좀 만들어놓으세요! 답답해 미치겠어요! 그리고 쇼다운 할때 캐릭터 랭크 높으면 3등해도 아예 안주는데 그건좀 아닌거 같거든요! 3등도 잘한건데 아무것도 않받는건 좀 노답인거 아세요? 제 친구들도 처음에는 브롤 재밌게 했다가 다 지웠어요! 렉도 장난이 아니더라구요! 그리고 사람들 들어올때 로비도 좀 많들어 놓아주세요! 분명히 전에 까지만 해도 괜찮았는데 이번 이벤트 하고나서부터 짜증이나네요..! 또 제 친구들이 브롤하다가 짜증나서 핸드폰 뿌신애들도 있어요! 제발 슈퍼쉘님 브롤스타즈 신경쓰시는건 알겠는데 렉만좀 고쳐주세요!!!!!
22664,구글,부정,5,2019,11,7,슈퍼셀 형님들 장난 함니까! 지금까지 저가 폭파한적은 없었는데 슈퍼셀 너무한거 아니에요 주작매칭 패치 해 주시고 모티스 벽에 끼는 거 패치좀! 그리고 너무 지니까 너 무 빡종이네요 그리고 슈퍼셀 형님들이 러시워즈 서비스 종료한다고 했는데 브롤도 서비스 종료해야겠네요 그리고 저가 브롤을 5개월넘게 했는데 이런적은 처음이네요 슈퍼셀 형님들빠른 패치 부탁드립니다 그리고 요즘 밸런스가 안 맞는거 같습니다 그리고 저는 잘하고 있는데 팀원이 자기 혼자해요 그리고 상자에서 전설 나오는 확율좀 올려주세요
23037,구글,부정,5,2019,10,25,레드 와이파이가 계속떠요. 다이겼는데 레드와이파이 떠서 공격이 안되고 트로피하고 파워레벨도 같이 매칭해주세요. 그리고 갑자기 브롤이 안켜지는데 무슨일?
22307,구글,부정,5,2019,11,8,"밸런스가 너무 안맞는다 모티스 트로피 올리는게 너무 힘들다 솔쇼로 존버타려고하면 쉘리밭이던가 티밍하던가 해서 3등안에는 운이 좋아야 겨우 드는데 밸붕아니냐 그리고 긴급밸패에서 쉘리나 엠즈 너프는 안하고 쓸대없는거만 패치하고 쉘리, 엠즈를 너프하던가 모티스를 버프하던가 모티스 쓰기싫어진다. 나는 스타파워가 없는데 전체 10명중 7명이 스타파워가 있음. 무과금으로도 오래안하면 스타파워 못얻는데 나같은경우 5달정도 한 계정에 POWER 8이상이 없음. 부계에 20000원정도 현질해서 겨우 파워8달성했는데 상자에서 PP나오는게 너무 들쑥날쑥하다 어쩔땐 일반브롤상자에서 35개가 나오면 대형상자에서 30개가 나오는데 너무 심한거아니냐 무과금배려해준다고 이벤트 많이 만들었는데 그것도 거의 쓸모가 없음 게임을 많이 못하는사람은 스타토큰 얻는게 너무 힘듦. 메가상자도 보석80개 즉 5900원을 모아야 살수있는데 너무 현질유도같음. 예를들어 솔쇼 5등안에 들면 토큰더블러를 준다던가 이런이벤트를 해야함"
22671,구글,복합,5,2019,11,21,"브롤스타즈를 재미있게 즐기고 있습니다. 하지만 특정 브롤러는 활약할 곳이 없고,어떤 건 너프되도 사기인 것이 있고,현질하지 않는 사람은 스타파워를 얻기 힘든데 그 점을 고려했으면 합니다."
22674,구글,복합,5,2019,11,11,게임은 재미있고 좋습니다 근데 도대채 왜 와파랙은 날이 갈수록 심해지죠? 원래 패치를 하니까 점점 줄어들어야하는거 아닌가요? 지금 브롤스타즈가 인기있다고 관리를 이따구로 해도 되는건가요? 지금 모든 유저들이 와파랙을 없에달라고 요청하고 있잖아요! 슈퍼셀님들 지금 브롤스타즈 와파랙만 없에도 매출 10%이상은 올라요 좀 생각해보세요 브롤스타즈 와파랙땜에 끊은사람이 태반인데 와파랙만 고치면 그분들 다들어와서 브롤스타즈 진짜 대박나는건데 왜그러시죠? 아 그리고 모티스 버프하세요 버프 너프 없다해도 다른놈들 다 버프되고 모티스만 그대로니 정말 게임이 힘듭니다 와파도 한목하네요
22689,구글,부정,5,2019,11,11,아니 와이파이는 분명히 연결 되있는데 와파가 안된다뜨면서 멈추고 렉때매 자꾸 죽어요 그래서 와파끄고 데타로 해봤는데도 그럼 이거 엏게 해야함? 그리고씨*우리는좋은거안해줌?ㅋㅋ하늘팀은엠즈 샌디이런거안해주냐고 ㅋㅋㅋ
22326,구글,부정,5,2019,11,10,"저는 8000 트로피 유저입니다~! 브롤 매우 재밌지만 문제점이 있습니다. 제 생각으로 너프사항 써봅니다. 1.쉘리 밴드에이드-게이지 상대 유저에게 보이게 함.(비비 홈런게이지,모티스 돌진 게이지 포함) 2.레드 와이파이(집이 아니면 심하네요) 3.매치매이킹 밸런스(레벨차이가 너무 심하네요) 4.불의 궁극기 이동 속도 증가(대릴 궁극기처럼 빨라지길 바라네요) 5.근접에 유리한 테이크다운 맵 만들기(원거리가 너무 많아요) 6.샌디 스타파워(거친모래) 40->100으로 증가 7.클랜전 추가 8.부쉬에 숨으면 보이진 않지만 10씩 데미지 깎기(존버가 너무 많아요) 9.브롤 볼,다른 모드등 탈주나 자책골 넣으면 트로피 2배로 마이너스,승리해도 반만 올려주기 이 9가지만 너프,패치되면 아주 재밌는 게임일 것 같습니다~! 슈퍼셀님!~너무 감사드리고 위 9가지 패치&너프 부탁드려요~! 밸런스 업데이트는 둘째치고 일단 매치메이킹 개선부터 하세요!!!!!!!!!!!!!!!!!!!!!!!!!!!!!!"
22329,구글,복합,5,2019,10,28,브롤스타즈 매칭 상태 심각함 그리고 레드와이파이도 미치도록 뜸 어떻게 수정도 안함 이런 게임은 손절이 답임 (그렇지만 여한이 남아 하는 나) 이런 ㄱ같은 말한거 정리하자면 레드와이파이랑 매칭상태 고치라는거야 거기에 브롤러 확률이랑 서버렉이랑 밸런스 패치좀 해 사람들이 잘쓰는걸 너프시켜야지 안쓰는걸 버프시키냐? 하....어이털린다 그리고 문의넣어도 자세하게 검토한다면서 리뷰는 안보냐? 실망이다 브롤스타즈 그리고 현질유도 너무심하잖아 처음엔 괜찮은줄 알았는데 갈수록 넥슨닮아 가네 여러분 손절합시다!!! 이상 긴 글이였습니다!
22330,구글,부정,5,2019,11,12,12000점 유저인데 레드와이파이때문에 못 하겠네요. 갈수록 심해지고 점점 똑같은 패턴도 지겹고 티밍들도 심한걸넘어서 티밍을 안하면 이기질 못해요... 클오클이랑 클래시로얄 때부터 해와서많이 좋아하는 게임회사인데 이번건 쉴드쳐주기엔 개선하려는 생각이 보이지 않습니다.
22334,구글,복합,5,2019,11,17,"제발 팀 트로피 강제로 떨어뜨리는 브롤러 신고하기 기능좀 만들어주세요, 다른 게임들은 신고하기 있어서 신고한 플레이어한테 경고및 제한 줘서 괜찮은데 이 게임은 게임하는 유저들 생각은 많이 안 하고 무조건 현질유도하게 하니까 정말 재밌어도 좋은 평가를 주기가 힘들어요.."
22712,구글,복합,5,2019,10,24,음 트로피 올리는게 어려워요 좀더 트로피 시스템을 더좋게해주셨으면 감사하겠구 랭크 맞추는건 괜찮은데 파워도 똑같이 해주시면 감사하겠습니다. 그다음 엠즈 빨리 너프 시키고 그러시면 좋겠습니다. 게임은 잘만들었네요 그럼 이글을 참고해주셨으면 합니다.
22714,구글,부정,5,2019,10,26,캐릭이 매우느려 생각보다 무빙이 어렵고 캐릭터들도 엄청 안뜸. 그리고 나는 한가지 캐릭만 애정으로 키우고싶은데 카드도 맨날 레벨낮은애들만 뜨고 트로피 모을려면 캐릭터들 다 키워야해서 짜증남. 클랜은 왜있는건지도 모르겠고 클래시 로얄처럼 지원이라도 추가해야함. 트로피 방식을 일반겜이랑 랭크겜으로 바꾸고 캐릭터도 자기가 키우고싶은거 위주로 키우게 해주면 좋을듯.
22366,구글,부정,5,2019,10,26,"와~ 너무 잘 만들었네요! 트로피 1000개 정도 됬을때 전설유닛 스파이크가 나왔구요~다음날 팸 나오구~그다음날 파이퍼~ 이렇듯니 저는 운이 보통인데 그3개가 3일만에 나오더라구요~ 그리고 지하철에서 브롤상자를 깠는데! 타라가! 나왔어요! 신화도 꾀 잘나오는것 같네요^.^ 그리고신규캐릭 진이 출시된지 몇일 안됬을때 브롤상자에서! 진이 나오더라구요! 별1개올린 사람들 산경쓰지마세요^.^ 전 그냥 이게임이 완벽하다 생각드네요!지금 못 가진건 8비트,엠즈, 레온,크로우,샌디"
30400,구글,복합,5,2019,10,25,정말 재미있는데 브롤러가 너무 안나와요 좀 나오게 해주세요
28267,구글,부정,5,2019,11,21,팀매칭 시스템좀 다시만들어라 파워낮은애들 존버해서 점수올리고 실력은 개판이고 3:3하면 암걸릴꺼같다
28968,구글,부정,5,2019,10,26,사운드 오류좀 고쳐라 왜 효과음 하나씩 빠지는겨
28988,구글,복합,5,2019,11,15,다 좋은데 개릭터 보 스타파워 그거 하나 때문에 2점 준다 제발 너프 좀....
30434,구글,긍정,5,2019,10,29,제 인생게임!! 이정도로 열심히 한게임 없음 전설과 스타파워 까지 역시 갓퍼셀! 짱!
30437,구글,긍정,5,2019,11,4,새로운 브롤러가 생기면 새로운 재미 엄청 재밌어요
30461,구글,부정,5,2019,10,31,레온24랭크때어떤사람들티밍해서20개떨어짐...하신고버튼경이ㅅ에서할수잇는거생겻으면 ㅈㅂ
28304,구글,긍정,5,2019,10,28,젬그렘보석모으는게재밌고쇼다운에서는파워큐브를모으면서친구들과맞써싸워이겨서정말재밌었습니다.^^ㅋㅋㅋㅋㅋㅋㅋㅋㅋㅋㅋㅋㅋㅋㅋㅋㅋㅋㅋㅋㅋㅋㅋㅋㅋㅋㅋㅋㅋㅋㅋㅋㅋㅋㅋㅋㅋㅋㅋㅋㅋㅋㅋㅋㅋㅋㅋㅋㅋㅋㅋㅋㅋㅋㅋㅋㅋㅋㅋㅋㅋㅋㅋ
29023,구글,긍정,5,2019,10,24,너무재밌신규브롤러도않나오고..팀메치도좀....
29046,구글,부정,5,2019,11,11,재꺼 트로피가 10100쯤인데 전설이 안나와요 남들은 막 1000에서 크로우 나오는데....전설나올 확률 좀 올려주세요 부탁합니다.
29048,구글,복합,5,2019,11,11,그래픽도좋고브롤러도좋은데 상자비율좀 올려주세요
29049,구글,부정,5,2019,11,10,"질문입니다:레온은왜 얼굴을 가리나요...!?2째질문:8비트는 왜 게임기 안가 요?3째질문:왜 크로우는 까마귀 인가 요? 궁금하고요,그 대신 좋은건 이 게임이 왠지.....?기분을 좋게(?)해주네요....!그 대신 약점은?죽을때 마다 다른 사람이 저(우리팀 말고)보석을 가져가니 저가 기분이 나빠지는 약점!🙁🙁🙁그리고 이짜증나네......욕 참기 싫어!라는 말을 해서 완전히 짜증났어요!!!! 그동안 저가 좋아하는 캐릭터:레온.8비트,타라,모티스:가 제일 최애 캐릭터 고,좋습니다!!!!더 즐겁고,재밌는 브롤스타즈 하길 바랄게요!(레온 모자를 벗긴 거 해주세염!)"
29797,구글,부정,5,2019,11,21,너무 강한 브롤러를 처음부터 만나서 조금 아쉽습니다
29814,구글,긍정,5,2019,11,11,아주제미있지만브롤러가잘안나와도재밌어요
29835,구글,긍정,5,2019,11,2,이 게임은하면 브롤러가 많아지는게 재밌어요.
30485,구글,긍정,5,2019,10,25,수퍼셀님브롤러확율이너무안좋아요 확율좀높여주세요
28374,구글,복합,5,2019,11,11,재미있음 근데많이공격조준이안됌스파이크스타파워 가시 가유도미사일이면사기
29090,구글,복합,5,2019,11,9,너무 너무제미있어요!!!!!!!!그리고브롤스타즈에할로윈이찾아왔다는데.................세로운브롤러가.........생겼어요. 그브롤러이름은.......................엠즈입니다.8비트보다..........놉은곳에있는데.................트로피가엄청많이필요헤요.......근데브롤스타즈니까제미있지않을까요???ㅋㅋㅋㅋㅋ......아무튼브롤스타즈완전짱이에요!!!!!!!!한번깔아보세요!!!!!그럼........안녕히계세요 ~
29091,구글,부정,5,2019,11,9,야 슈퍼쉘 이걸 개임이라고 만든거냐!! 어 다운로드 해서 개임시작때부터 지금까지 개속 래드와이파이 맨날 뜬다 진짜 점수 안올라 간다
29855,구글,긍정,5,2019,10,28,"크로우,팸주세요 그리고 슈퍼셀 게임은 정말재미있어용"
30521,구글,복합,5,2019,10,27,"너무재밌어욯ㅎ 하지만 와이파이가 너무잘 먹히지가 않아요.그리고트럼피가 만 삼천이면 좀그래요 그리고 제가 샌디가 있었는데 계정이날라갔어요ㅠㅠ 어떯게 해서든지 좀 고쳐주세요 여기엔 단점도있고,좋은점도있네요 화이팅 !!!!"
28432,구글,긍정,5,2019,11,4,너무 재밌다. 왜냐면 총 으로 쏴는게 꿀잼. 점점 힘이 강한 브롤러도 생기고 완전 굿!굿!굿! 트럼피도 올라가면 좋고 그냥 다 좋다.
28485,구글,부정,5,2019,11,12,공격이 늦게 나가요 이거 버그 아닌가요?
28499,구글,복합,5,2019,11,21,업데이트데고 렉도 별로 없어져서 좋음 근데 브롤러 밸런스가 안 맞음
29182,구글,긍정,5,2019,11,2,브롤러들이 귀엽고 너무 재밌어요 다음에도 기대할께요
29200,구글,복합,5,2019,10,26,너무 재미있어요!그런데 신규 브롤러가 너무 안나와요ㅠㅠ좀 나오게 해주세요ㅠㅠ
29939,구글,부정,5,2019,11,13,신규모드 테이크 다운 너무 파워큐브가 많이나와서 파워큐브가 없는 사람들은 그냥죽어요.
29960,구글,부정,5,2019,11,5,상자 모아서 깠는데 영웅 브롤러가 잘 않나옴!!!!
29990,구글,긍정,5,2019,11,10,재밌고 좋긴한데 스킨에 부과효과가 있었으면 좋겠네요
30007,구글,긍정,5,2019,11,1,넘 재밌네요~ 상자깡을 하는데 브롤러가 잘 안나와요. 10개 넘개 모아도 안 나오네요
28552,구글,긍정,5,2019,10,27,너무재밌어요!브롤러도많고너무좋아용!
28573,구글,부정,5,2019,11,21,안뇽하세요?제가0점부터갓고싶어던크로우가안나와요...그래서스파이크도좋으니까전설확율놉혀주세요제발요..제트로피는11919인데😢안나와요 제발놉혀주세요....(전설1밖에없음)
28577,구글,부정,5,2019,11,4,와이파이4칸이데렉걸리고 밸런스개판쇼다운론스타맵이너무개방적인게많고트롤러들신고도못함로딩속도차이로공정함전투임됨
29291,구글,긍정,5,2019,11,16,너무 재밌어요 브롤러도 많고 즐겁게 플게이 하고 있습니다.
27860,구글,복합,5,2019,11,21,정말 재미있어요!근데 조금만 브롤러 사는 값을 내려주세요
27886,구글,부정,5,2019,10,27,8비트를 얻었어 쓰려니 앰즈때문에 게임을 못하겠어요.그리고 게임을 하면 저 빼고 다 앰즈에요.엠즈 너프 좀 부탁합니다.
28630,구글,긍정,5,2019,10,28,아주재밌다.퀄리티도고퀄이다.슈퍼셀사랑해요♡ 브롤러도 하나하나모으는게신비롭고재밌다
29321,구글,부정,5,2019,10,27,브롤은다제미있는데 클랜중#9U22GGV0라고 치면 트로피가1000도 안돼는데브롤러30개가 다있고 스타파워도 다있어서이상해요. 고쳐주세요^^
29328,구글,부정,5,2019,11,12,저한테 왜 그러십니까? 레드와이파이 뜨고 죽는게 말이되냐고요! 그리고 브롤러 확률좀 그래서안나와서 현질하고 다얻었어요! 진짜 현질때문에 브롤러 다있어요! 넘짜증나!
29331,구글,긍정,5,2019,11,7,브롤러 나올 확률좀 높여주세요.제발요.제발요.전설 나올 확률은 거의 불가능 수준이에요
29355,구글,부정,5,2019,11,1,팀매칭 역대 최악/2019년 11월 1일 오늘 날짜로 중국 유저들 핵 사용중/데미지 잘 안먹힘/오토 플레이로 자동 랩 상승 및 코인 상승/절대 못이김/뽑기운도 역대 최악/게임 삭제 합니다
30052,구글,긍정,5,2019,11,21,크로우 버프좀 주세요 제발 크로우를 가지고 있는데 모든 브롤러에게 죽어요 트로피는 6500이에요ㅠㅠ 크로우 버브좀 주세요 지금 6450으로 떨어졌어요ㅠㅠ 버프 감사합니다
30097,구글,긍정,5,2019,10,31,아ㄴ재밎는대 트로피올리기힘들고 브롤러들 뽑긷&힘들너요ㅠㅠ 패치좀
27906,구글,부정,5,2019,11,21,친구들은 이겜 망겜이라는데 저는 재밌어어 하고있어요. 친구가 망겜이라고 한 이유가 전설이 않나와서래요. 전설 브롤러 확률 좀 올려주면 좋겠네요.
29398,구글,긍정,5,2019,10,25,쫭 한고무즐처럼지우고십지안지만어떨땐 이 빨갈고화날따도있는최고의개음 다 운로드하새용브롤스타즈
30129,구글,부정,5,2019,11,21,"핵이너무 많아요 무적핵,에모무적핵,피무적핵,사거리핵,두가지스타파워동시사용핵."
28729,구글,긍정,5,2019,11,14,"캐릭터도여러가지있고,브롤러도상자에서얻을수있어서좋아욯ㅎ브롤스타즈최고!♥♥"
28004,구글,부정,5,2019,11,6,현질을했는데안됨 전설3개빼고다있었고스타파워도있었는데현질하고나서안됨
28759,구글,부정,5,2019,11,14,상자를 200개 열었는데 아무것도 않나옴 이게말이되나. 신규브롤러는 나와야지.
28033,구글,부정,5,2019,10,24,파워가 비슷허면 잼나는데 이쪽은 파워가5인데 매칭은 10걸림 피랑 데미지 넘사임
28039,구글,부정,5,2019,11,6,진짜 쓰레기 게임임 트로피 진척도가 제일 사기임 또 기본캐는 연속궁에다 못이기는 브롤러가 없음 진짜 절대 하지마셈 걍 현질 좇망겜 시간 낭비임
28063,구글,부정,5,2019,11,2,팀원들이 공격하라고 계속 놀고 있어서 트로피.가 계속 까겨요
29513,구글,복합,5,2019,10,27,저 근데 다 괜찮은데 크로우만 좀 주시면 안될까요? 크로우 독땜에 한두번 죽은게 아니거든요 제발요
29534,구글,긍정,5,2019,10,26,대박! 엄청제미있고 브롤러커리티가 작살나요.
28093,구글,부정,5,2019,11,11,스타포인트로 브롤러구매했는데 브롤러가없음 문의로는 24시간기다리라는데 24시간이지나도안들어옴 현질한부분만 구매취소만있고 포인트모은거는취소나환불안되는건지?? 이런문제가많은거같은데 이런것도 똑바로조치가안되면 모을필요가머있나요??
28842,구글,긍정,5,2019,11,10,정말 재밌어요!! 브롤러가 안나오긴 하는데 그래도 꿀잼!!
29577,구글,복합,5,2019,11,15,재미있는데 겜시작로딩중 팅김현상이 지속되네요
30270,구글,부정,5,2019,10,30,레디와이파이때문에 다죽인 브롤러도 못죽이고 오히려 제가 죽네요. 레드 와이파이좀 없애주세요.
30280,구글,부정,5,2019,11,20,티밍 땜에 600에서 줄었습니다 제발 티밍 좀 없애 주세요! 아니 레드와이파이때문에 지금 파워플레이 계속 져서 억울새 죽겠어요!
28127,구글,부정,5,2019,11,7,드디어 포코 스타파워 2개 스파이크 스타파워 드디어 얻을 수 있게 됨 ㅠㅡㅠ 그리고 너무 재밌어요.
28894,구글,부정,5,2019,10,27,"아니 다른애들은 크로우,레온,스파이크등 나오는 데 저만 전설안 나와서 트로피만 계속 깍겨요"
28178,구글,부정,5,2019,11,16,"이전에 쓰던 폰이 고장나서 아예 안켜지는 상태인데, 새폰으로 이전의 계정을 쓰는 방법은 없나요?"
28188,구글,복합,5,2019,11,21,정말 재밌어요 근데 새로운 브롤러가 생겨스면 좋겠습니다 ^-^
26815,구글,부정,5,2019,10,24,이거 너~~~~~~~~~무 재미있는대 브롤러가 안 뽑혀요 잘뽑히게 해주새요 그것말곤 재미 있어요~~~
25534,구글,부정,5,2019,10,25,"아니 콜트가 500점이여서 브롤볼 한 판 돌렸는데 우리팀 제시 0점 나500점 프리모 500점 이게말이 됩니까? 이런거 수정 해주시고 렉,와이파이는 빵빵한데 버그도 제대로좀 해주세요!!! 제발요 그것때문에 스트레스가 엄청나요"
25539,구글,부정,5,2019,10,31,아니 저기요 전 트로피가 2279인데ㅋㅋ브롤러가 14개가 말이 되나요?ㅋㅋ1000트로피 유저도 14개 넘는데 왜 안돼나요?고쳐좀 주고 브롤상자 열때 브롤러좀 많이 너줘요ㅋㅋㅋ
25556,구글,긍정,5,2019,11,1,예ᆢ.아주 재밌습니다.슈퍼셀 형님 감사합니다 저 브롤스타즈 전설 크로우 있습니다.솔직히 레드 와이파이 말 끘났읍니다.
26860,구글,긍정,5,2019,10,28,슈퍼셀 형님들 이게임 너무 좋아요 그러니까요 ㅠ 549보석에 전설팩 (레온 + 크로우) 사게해주세요 제발 ㅠㅠ 저 전설가지고 싶어요
26863,구글,부정,5,2019,11,4,이동 버튼만 잘 뭄직이면 상당히 양호한 겜일듯.맘에 드는군요
26877,구글,부정,5,2019,11,21,레드 와이파이와 서버 상태에 문제가 있지만 재밌습니다
27527,구글,긍정,5,2019,11,9,당신의 인내심을 체험하는게임. 화병걸리고싶으면 당장 다운로드 ㄱㄱ
25594,구글,긍정,5,2019,11,14,진짜 게임 못해먹겠네요...하...진짜상자깡도 너무더럽구요 매일같은맵 매일똑같은 브롤러 진짜지겹습니다...현질유도너무심하네요
26199,구글,부정,5,2019,11,14,오프라인 상태에서도 친선전을 할 수 있었으면 좋겠고 인공지능을 내가 직접 정하거나 없앨 수 있으면 좋겠습니다
26203,구글,부정,5,2019,10,29,안녕하세요 제가 게임을 삭제 했다가 다시 깔아서 연동하기를 했는데 8300점인 제 계정 14점으로 되었습니다 어떻게 해야 할까요 ?(닉네임을 까 먹었습니다.) 기본 캐릭터부터 초휘기 까진 다 있는데요 신화는 타라 하고 진 박 에 없습니다 전설은 레온하고 스파이크가 있음이다. 복원 해줄 수 있나요?
27602,구글,복합,5,2019,11,2,재미있지만 상자에서 신규 브롤러가 잘 안나온다
27606,구글,긍정,5,2019,11,9,엄청 재밌습니다 그리고 공통점이 많아요 스타파워 를 얻을 수 있으니 좋아요
25617,구글,부정,5,2019,10,25,잼있는데.. 트로피7300이넘는데.. 영웅부터는한마리도없어요 브롤러뽑기가왜이리힘든지..
25634,구글,긍정,5,2019,10,25,진짜 다른건10점 만점에 10점인데 레온 목소리만 제발요ㅠㅠ 레온 팬으로써 이건아닌 것 같네요ㅠㅠ 더도 말고 목소리만 어떻게 해주세요ㅜ.ㅜ
25636,구글,부정,5,2019,11,4,친선전 테이크 다운 나가기 누르고 메뉴 화면 보이기 전에 빠르게 시작 누르면 브롤러가 거품으로 변하고 서버 튕겨요.
26927,구글,복합,5,2019,11,4,일반적으로너무질리고레드와이파이가오지게떠요.운빨도있고현질빨오지고근데현질하면너무비쌈
27631,구글,복합,5,2019,11,1,제가 이게임을해봤는데너무좋아여❤ 그런데 레온 스킨이 클렉시레온도 나왔으면 좋겠어요 그리고 이게임 깔아봐요 검나재미있고 짜릿해요❤❤
27633,구글,부정,5,2019,11,13,브롤스타즈 절때 플레이 하지말다자. 1.현질 유도 브롤스타즈는 현질겜 이라 봐도 무방이다. 상자에서 브롤러가 나올 확률은 매우 적고 확률이 좋은 상자는 모두 비싼 가격을 자랑한다. 2.밸런스 한마디로 최악이다. 브롤러가 나오면 다음 브롤러가 사기성을 가져가고 나중에야 밸런스 패치를 하는 게으름을 가졌고 예전 브롤러는 거의 버려진다. 3.최적화 게임을 하는중 인터넷 연결이 잘되있음에도 일명 레드 와이파이가 나타나고 프레임이 끊기는 문제가 심하다. 이러므로 브롤스타즈는 100% 훌륭한 쓰레기 게임이다.
25653,구글,긍정,5,2019,11,2,왜 엠즈가 나오고 나서부터 이동조이스틱을 드래그하는데 공격조이스틱이 드래그 되나요 그리고 자꾸 레드와이파이도떠요 수정해주세요 슈퍼셀
25672,구글,복합,5,2019,11,16,근데 왜 그러시죠승언 님 그러니까 재미없으면 삭제해라 삭제하면 너 캐릭터 그런 거 모두 없어지니까님 만 재미 없는 거고 그럼 삭제해
25674,구글,복합,5,2019,10,27,이게 게임이냐? 밸런스도 않맞고 무슨 현질만하는게임 으로만 보이잖아 흑우들좀 있어서 좋냐? 참나어이없어서 이겜 100%망한다 ㅉㅉ 이딴게임 만들지나말고 계속하게 하고싶다면 브롤러 나오는 확률이나 올리셈 쨌든 레드와이파이 않고치면 이딴 ㅈ 망할게임 다신 않함
26287,구글,긍정,5,2019,10,30,트로피를 높인사람만 강해지니 초보플래이어들이 트로피올리기 힘드니 브롤러 트로피 말고 플래이어 트로피로 하는게 좋을것같아요
26981,구글,부정,5,2019,10,25,씨 왜 공격이 안 써짐 그리고 랙도 고쳐라 그리고 신고기능도 없냐?
26996,구글,부정,5,2019,11,20,특수 능력이 무적기이고 기본기가 마법인 캐릭터가 나오면 좋겠네요~^^
