ID,STORE,LABEL,SCORE,YEAR,MONTH,DAY,CONTENTS
12589,애플,복합,5,2019,4,28,로사 너프좀다 좋은데 로사 너프좀 해주세요. 궁도 너무 빨리차서 거의 무적이며 대미지도 강하고 사거리도 근거리 치곤 길어 쇼다운 맵에 있는 강을 넘으면서 때릴 수있어요. 게다가 피도 많아서 잘죽지도 않는데 거기다가 풀숲속에서 힐링되는 거랑 매번 쉽게 차는 궁을 더하면 로사를 이길자가 없어요.ㅠㅠ 제발좀 너프해주세요. 게다가 모드가 아예 브롤 볼이 아니라 로자 볼이 됬네. 무조건 로자 한명씩 있고 그냥 공잡은 다음 궁 키고 공 가지고 걸어서 들어갈 수 있는 갓모드. 제발 제로자좀 너프하던가 없애든가 해라
12590,애플,부정,1,2019,4,27,팀밸런스진짜 어이없는개 티밍은 티밍은대로 존나게 만나고
12592,애플,부정,3,2019,4,27,실력좀맞추자아니슈퍼셀님좀실력좀맞쳐주세요적은잘하고우리팀은못하는사람만뜨고트로피는많이떨어지니손해에요팀실력좀맞쳐주세요브롤스타즈는재밌지만티밍같은거는재미없다진짜실력좀맞쳐주세요
12593,애플,긍정,1,2019,4,27,로사 너프해!!너프안하면 너 콤파니
12595,애플,부정,5,2019,4,27,렉ㅈㄴ걸려요 ㅅㅂ..아니 다른게임은 잘만되는데 ㅅㅂ 니네게임만하면 ㅈㄴ렉이걸려 서버가문제일까 내폰이 문제일까??리뷰보니까 한두개가 아니던데 시발려ㄴ들아??
12596,애플,부정,1,2019,4,27,로사 개같네요아니시발 로사 밸런스 조정 해야지 시발
12597,애플,긍정,3,2019,4,28,시발시발 로사 너프 안시키냐 역시 수퍼셀
12598,애플,긍정,1,2019,4,28,로사 너프좀 먹여라로사나오고 밸런스 붕괴됫네 로사 너프 먹을때까지 안합니다
12602,애플,긍정,1,2019,4,27,브롤이런 슈퍼셀 개자식들.로사 너프 인 시키면 이 게임 접는다.맨날 레온만 너프하고 있어. 개자식들.ㅗ
12604,애플,부정,1,2019,4,27,시발년들아아니 처 돌았음? 로사 6초동안 받는피해 80퍼 되니까 1:9 해도 이기겠다 무슨 3명에서 1명을 못잡게 케릭을 처만들어주셔가지고 로사 개새끼가 궁을 쓴지 2초만에 궁 다씨쓰네요 시발 ㅈ망갬 너프 안할꺼면 케릭 삭제 시키세요 브롤 접습니다 ㅗㅗ
12605,애플,부정,1,2019,4,27,아니  패치좀아니 패치를  왜  이따구로하는거지  진짜  별  주기도 싫네  와이파이 빵빵한데  렉  자꾸먹고  브롤러 밸런스 개똥이고  신규브롤러는  왤케  뒤지지도않냐  이게  생각을  하고 만든  캐릭이냐  혼자서  3인분을  다햄먹고  궁차면  뒤질  생각을  안하네 ;이건뭐  궁  무한쿨타임으로  만드시지  돈 벌만큼  벌으셨나봐요  슈퍼셀  실망이네 에휴
12608,애플,부정,2,2019,4,27,로사때매 벨붕 ㅡㅡ..솔직히 전설은 좀 더 좋게 하줘야대 ㅡㅡ
12609,애플,부정,1,2019,4,27,쓰레기중 쓰레기와 진짜 짜증나는데 해주는사람은 천사다 이딴 망겜을 하는가람들은 천사다 와 진짜 인간도 아닌 엄마없는놈들ㅋㅋㅋ 나가뒈지고 그냥 살지마 ㅋㅋㅋㅋㅋ아후 돈에 눈이 멀어갖고 에휴 ㅋㅋㅋㅋㅋ미친 새끼들 즁신 호로잡년ㅋㅋㅋㅋㅋㅋ 돈요구 미쳤다 ㅋㅋㅋㅋ 매칭도 주작이고 와이파이 빵빵한데 와파문제 ㅋㅋㅋ핑계냐 주작이냐 이 ㅅㄲ들아 주작이티가 난다에휴 인생 그딱으로 살지마라 미친 로사 밸붕
12611,애플,긍정,4,2019,4,26,로사가 넘모 사기임궁극기를 쓰면 피가 잘 안달음
12614,애플,긍정,3,2019,4,26,로사 벨붕 넘심함 너프시켜야함게임벨런스 다망가뜨리고있음 나야 꿀빨고 있긴한데 빠른너프가 되야 벨런스 맞을듯
12615,애플,복합,1,2019,4,27,하 답없음브롤 스타드 하지마세요.ㅈㅂ 일단 초딩겜이여서 전략이 없음 우리팀 ㅈㄴ못함 근데 상대팀도 ㅈㄴ못함
12616,애플,부정,1,2019,4,27,팀차이시발 개새끼들아 팀을 무슨 좆같이 짜냐 상대편은 파워가 10에 스타파워 있는데 우리팀은 파워7이고 랭크도 매치 이상하게 시키고 게임 매칭 다시 만들어라 개시발 슈퍼셀 개좆같은년들아
12617,애플,긍정,1,2019,4,27,로사 개사기로사 무한궁에다 무슨 끝판왕 보스야 보호막이무슨 무한힐에다 다막아
12618,애플,부정,1,2019,4,27,브롤 망겜아니 만나는 얘들 캐릭터 고려하고 트로피 고려해서 만나게 하면 안되나?
12619,애플,부정,1,2019,4,27,아후진짜 매칭시스템이 ㅈ같아서 못해먹겠네요 ㅅㅂ것
12620,애플,부정,1,2019,4,24,병신들이만든망겜개쌔씨야니들은1살짜리애기만도못해알았냐?개쌔끼병신아에휴간나쌔끼🖕🖕🖕🖕🖕🖕🖕🖕🖕🖕🖕🖕🖕씨발니이럴거면겜만들지말고회사망해니회사망하는거야씨발닥쳐라개쌔끼야그리고밸런스가맞게해야지씨발아병신회사집어치워라🖕🖕🖕🖕🖕🖕병신이씨발개쌔끼야밸런스를맞게해줘야지씨발아씨발내가서울에슈퍼셀회사가서다이너마이트폭발시킬께씨발^^병신아하다하다못하겠냐?현질유도하지마병신아그리고게임을만들거면좀제대로만들어병신아밸런스안맞아서지고세상에이런망겜은슈퍼셀이잘만드네병신아이거망겜수고~🖕🖕🖕🖕🖕🖕🖕🖕🖕🖕🖕🖕🖕🖕🤬🤬🤬🤬개쌔끼야내가방금젬그렙했거든병신아?전설2명이나나왔네?^^병신아겜만들거면좀제데로만들어병신아
10216,애플,부정,1,2019,4,27,로사롤백해라 / Erase Rosa매판 나오는데 캐릭터 중복 허용되는 빅브롤러 모드는 여섯명 전원 로사 선택함 ㅋㅋㅋ 저딴거 만들어놓고 이것도 업데이트라고..
10326,애플,복합,5,2019,4,25,인생 최고의 게임중 2위 게임!제가 원래 픽셀건을 좋아하는데 이건 생각만 해도 정말 재미있는것 같아요. 그리고 스킨 몇개좀 만들어 주세요.(ilik is pixel-gun3d like this good!. and       skin please! it’s ‘브롤 스타즈` it’s good! Spike skin please))     :).     :D 근데 새로운 브롤러 좀 뜨게 해 주세요 제 닉네임은 퀘스트를 바라보며 입니다.(hm.. and new ’브롤러` please my name is 퀘스트를 바라보며)      hahaha noob!!!!! im pro! leon please and Bo and Dinermike CRow please
34258,구글,부정,5,2019,4,28,"슬슬 슈퍼셀 하는 모습이 눈에 띄네요. 와이파이 4칸인데도 불구하고 빨간 와이파이 표시가 자주 뜨고 티밍으로 인해 솔로 쇼다운은 거의 불가능 해지고 고랭크로 갈수록 듀오쇼다운이나 셋이 파티로 게임을 진행해야만 점수올리기가 가능해질 정도로 힘들어집니다. 이번에 나온 희귀브롤러도 밸런스가 조절이 안돼 메타브레이커가 되버린 상태입니다. 또 주작매칭도 심하긴 한데, 슈퍼셀 게임 하면서 승률 맞춘다고 주작 매칭 당한 경험이 상당히 많기 때문에 그냥 해탈하고 넘어가겠습니다. 위에 언급된 이런 고질적인 부분들은 예전 슈퍼셀 작품에서도 많이 봐왔었는데 브롤스타즈에 와서까지도 결국은 못고치네요.."
34630,구글,부정,5,2019,5,4,전체적인 게임 구성 및 완성도는 좋습니다. 허나 1. 간헐적 이동멈춤에러 너무 심합니다. 현재 갤s8사용중인데 이동키가 먹질않아요. 2~3판 1번 꼴로 나타납니다. 2. 접속오류. 첫로그인시 무조건 튕기고 2번째부터 접속가능합니다. 1번사항은 시급히 수정 요청드립니다.
34653,구글,복합,5,2019,5,9,"게임은 재미있지만 쇼다운 솔로 이거 어떻게 패치 안됩니까? 티밍 진짜 극혐이네요. 열심히 노력해서 상대들 제거해가면서 얻은 파워큐브인데 그게 많다고 그따구로 원딜러 3~4명이서 엄청 다굴이 해대면 어떻게 겜하라는거죠? 점수 올리기 극혐이고요. 팀대전은 안하는 이유가 랜덤매칭이 너무나도 안좋고 서버는 자주터지고 무엇을 하라는 걸까요? 전 즐기고 싶은데 던지는 팀, 잠수타는 팀 이런 팀원들 만나면 어떻게 즐깁니까. 개선부탁드립니다."
34354,구글,부정,5,2019,5,3,"1.제발 로사 너프시켜주세요 체력,피해량이 너무 높습니다 게다가 로사가 특수공격을 쓰면 그냥 1대1로 이길수없이 딜이안들어갑니다. 피해량 감소 최소 60~65로 바꿔주시면 감사하겠습니다. 2. 보를 좀버프 해주세요 트로피 힘들게 3000개를 모아서 써봤는데1렙 기준 공격일 다마춰도 4500. 받게안들어가네요 화살 딜좀 600~800좀 버프해주시면 감사하겠습니다. 3.쇼다운 잼그램 바운티 는 트롤이별로없는데 브롤볼은 상당히 트롤이 많습니다. 볼을 끌고 자기 팀 에가서 차책공을 넣습니다. 제발 신고 버튼이 생겼으면 좋겠습니다. 4. 모티스 버프 모티스 에너지가 너무 안올라가네요 하나 채울려면 최소 2초걸립니다. 제발 모티스 버프 해주세요.브롤상자 200개모아서 깠는데 모티스가 나와서 좋았는데 성능이 매우 별로네요. 5.브롤스타즈 빨간 와이파이 때문에 렉이 정말 심하네요. 빨리 패치해서 꼭 빨간 와이파이 꼭없에 주세요. 6. 브롤러 나올 확률 좀 쫌만 높여 주세요."
34673,구글,부정,5,2019,4,28,슈퍼셀형님들 로사 출시돼자마자 망해가고 있어요. 쇼다운에서 로사아니면 그냥 끝나네요. 빅게임도 마찬가지고여. 80%감소는 너무사기에요. 패치해주셔야 할것같네요. 아 그리고 티밍문제 해결된거 맞나요? 왜 게임할때마다 티밍이 저의 트로피를 낮추죠? 애초부터 티밍에 관심가졌어야죠. 지금와서???????제친구 트로피 300인데 티밍하자는 신호온답니다. 어쩔꺼에요? 티밍하고 좀 떨어져있으면 유성우 안떨어지고 버섯 생기고...... 레온은 계속너프되서 거의 모든캐한테 지고 패치해주셔야합니다...진짜로!!!!!!!!!!!!!!
34674,구글,부정,5,2019,5,21,"저기요장난치세요 정말수준떨어지네요..... 이유1티밍을고친다면전혀고쳐지지안음좀잘하자. 뭐아직도다이너티밍땜에고생하냐고 진짜이러니까평점을이따위로주지 이유2와이파이장난? 아니와파5칸인데지금바로렉거리잔아요 아니뭐중요할때만또그러내..... 진짜대단하시다 어떻게데이터를써도렉이걸리냐고 이유3나지금5086점인데어떻게지금까지브롤상자 에서뜬게프리모,발리밖에없냐? 그리고나현질까지했는데 5164가어떻게4961보다쉽죠? 그것부터이해가안돼네요 이점좀제발진짜패치부탁아니이건진심입니다 제말좀들어주세요. 이런명성이자자한슈퍼셀먹칠하지말고. 이상입니다. ."
34680,구글,부정,5,2019,5,18,와이파이는 빵빵 잡힐때는 계속 끊기고 데이터쓸때는 잘대고 저기 브롤형님들 일부로 이런게임만든거죠?데이터만 먹을라고?이러지맙시다~^^.데이터먹을라고 이런게임 만들지 맙시다!아니면 수정을 하든가요~.저이게임 덕훈데 이러지맙시다.저가 이 게임 나온다는 소식듣고 사전예약하고선 따른사람들보다 먼저 이 게임을 돌려본사람인데~^^이러지맙시다^^.수정부탁드립니다^^.
34366,구글,부정,5,2019,5,19,슈퍼셀 형님들 와이파이돼는데 않됀다고 뜨고 케릭터가 안떠서 노잼이예요 그리고 솔로하면은요 저만공격해서 트로피가300이나 단적도 있어요.! 세로운케릭터 좀! 주세요! 슈퍼셀형님들 제발요! 짜증이나요! 노잼이예요! 그리고! 신케릭터 나오게 응원 헤! 주세용?! 스킨도 싸게 해 주시고요! 파이퍼 공격력 너프헤주세요! 슈퍼셀형님들!제발요! . 😆😆🐾 지금은 노잼 이예요! 악 팀원들 다 바보이고요 그러니 절떼 하지마세요
34367,구글,복합,5,2019,4,28,게임은 재밌다. 역시 슈퍼셀. 근데 너프고 뭐고 일단 제치고 로사 벨런스패치는 좀 빨리 해줘라. 게임 특유의 느린 듯 하면서도 통쾌한 전투의 스피드가 로사 하나 때문에 다 깨짐. 어느 판을 가나 우리팀이나 상대팀이나 꼭 1명씩 있는데 이것때문에 게임이 심각하게 루즈해짐
34431,구글,복합,5,2019,5,8,넘~ 잼있어요. 그런데 자꾸만 와이파이 터지는데 왜 안들어가지는지... 이거 왜 그런지 좀 알려주세요. 슈퍼셸님들.. 아 그리고 출석보상 같은건 없나요? 보석이라든가 코인이라든가 신0아파트 고스트 헌터에 비하면 .... 고스트 헌터가 혜자게임이네요. 출석보상좀 만들어주세요.
34442,구글,복합,5,2019,5,19,매칭 이거 너무한것 아니에요? 아니 5000점이랑 500점을 매칭시켜요? 1.매칭 시스탬 바꿔야 합니다. 트로피는 기본적인 실력이 있고 게임에 많은 시간을 투자해야지 트로피기 잘오릅니다. 하지만 이런 매칭 시스탬 때문에 기본적인 실력도 없는 뉴비가 잘하는 사람과 (팀)매칭을 시켜서 이기면 버스를 타는거고 지면 트롤이 되는상황 입니다. 게다가 이제 막 시작한 뉴비는 트로피도 잘안떨어지고 트로피가 높은 사람은 트로피가 너무 잘 떨어집니다 그래서 총 트로피가 비슷하고 브롤러 트로피도 비슷한 사람을 매칭 시켜야 합니다 2.신고에 트롤 신고 추가 못하는건 인정을 하지만 일부러 트롤을 한 유저들을 신고하자는 의견입니다 3.트로피 사이의 간격 통일 아무리 잘하는 사람이라도 트로피 보상 간격이 다르면 저같은 중수들은 힘듭니다. 4.대형상자와 메가상자 큰 차이점 두기 지금 대형상자와 메가 상자의 확률이 같습니다. 그래서 큰차이점을 두자는 겁니다. 메가상자는보석이 80개라는 이유가 1개밖에 없다
34460,구글,긍정,5,2019,4,20,"와!팀웍도 좋고 레벨도 잘 올라가니 기분도 좋고 자주 이겨보네요!그리고 멋있는 스킨도 많이 있고 싱글,멀티 모드와 다양산 모드가 있어서 재미있네요!그리고 요즘 게임엔 클랜이 많이 없어서 걱정 했는데 이 게임은 클랜이 있어서 좋았습니다^^"
34140,구글,부정,5,2019,5,20,항상 많이 즐겨하는 게임인데 빨간색와이파이 표시가 화면에 뜨면서 게임이 끊김니다. 와이파이가 가장 잘 터지는 거실에서 게임을 실행해도 똑같습니다. 제 폰에 이상이 있는 건가요. 이니라면 수정해주시면 감사하겠습니다. 그리고 이번업데이트 기대하겠습니다.
34468,구글,복합,5,2019,5,21,다양한 캐리터들과 다양한 전투장..??이있어섶재밌고 친구들이랑 같이할수도 있어 좋아요! 근데. 가끔씩 안들어 가질때가 있어서 20~30분 기달려야지 들어가지는데 그게 불편해요.. 그리고 트로피 올리면올릴수록 힘들어지고 트로피가 적어서 무시 당했어요. 트로피를 조금 쉽게 올리고 싶네요
34523,구글,부정,5,2019,5,13,한달쯤 해보고 제대로 써본다 일단 캐릭터 밸런스는 상당히 잘되어있는거같다 쓰기 힘든 캐릭터나 잡기힘든 캐릭터가 있지만 머리를 잘써서 상황에 맞춰잡거나 팀원이랑 협동하면 충분하다 캐릭터 상성이 꽤나 뚜렷하다 컨텐츠 5개가 따로따로 바뀌기 때문에 맵 컨텐츠 변경속도가 빠르게 느껴진다. 실제로도 빠르지만 빠르게 바뀌어서 더 좋다. 개인적으로 좀더 추가되었으면 좋겠다 랜덤상점도 나쁘지않다 트로피 얻기가 쉽고 캐릭터빨보다 손빨을 타는 게임이라 좋다. 문제는 트로피 얻기가 쉬어서 계속하다보면 쌓이기 마련인데 그때문인지 트로피 3000개가 넘어야 얻을수있는 캐릭터인데도 사람같이 하지않는경우가 있다. 아마 어린친구들인거같은데 전체적인 연령대가 상당히 낮은거같다. 아마 유튜브 광고로 인한것으로 생각된다. 팀빨을 많이받기때문에 혼자서 2인분을 해도 다른둘이 똥을싸면 지기때문에 상당히 빡친다. 그래서 4점준다 게임성은 5점
34527,구글,부정,5,2019,4,27,"제목:로사의 밸런스 조정 1.러사는 너프를 해야 한다. 로사의 궁이 발동되면 아무 타격을 안 입습니다. 로사가 궁을 쓰고 있으면 아무도 죽일 수없습다. 만약 죽일 수있다고 해도 무조건 한명의브롤러가 피를깍고 죽으면,다른 브롤러가 로사를 죽인다고 해도 궁을 쓰면 이길 수 없다. 로사의 너프를 바랍니다. 2.로사의 희귀도 조정을 해야 한다. 많은 사람들이 자신이 쓰고있는 레온, 크로우, 스파이크, 등 많은 전설 캐릭터로도 이길 수 없는 로사는 이미 전설을 뛰어 넘은 캐릭터라고 해도 과언이 아닙니다. 1레벨인 상태에서도 전설이 이길 수없는 로사가 희귀라는 것은 믿을 수없는 일입니다. 3.로사의 가격을 바꿔야 한다. 지금의 로사는 보석 19개에 살 수 있지만, 그 가격은 말도 안됩니다. 보통의 희귀는 보석 30~40에 팔지만 로사는 보통의 희귀가 아닌 전설을 뛰어넘은 브롤 캐릭터이기 때문에 세일이 끝나고 30개에 판다는 것은 있을 수 없는 일입니다. 수퍼셀은 이것을 읽고 개선하길바랍니다."
34542,구글,부정,5,2019,4,20,"트로피가 조금만 마이너스 됐으면 좋겠어요. 예를 들면 듀오쇼다운에서 5등을하면 트로피 마이너스 2개 4등은 마이너스 1개 3등은 플러스 2개 2등은 플러스 5개 1등은 플러스 8개로요. 저희 사촌오빠는 듀오쇼다운 5등하면 트로피 17개,18개 마이너스 된다고 하더라고요. 클럽은 어떻게 만드나요? 클럽에서 트로피 제일높은 사람이 대표가 됬으면 좋겠어요. 제가 클럽에서 트로피 제일 높은데 저희 클럽은 트로피 가장낮은 사람이 대표가 되어서 짜증나요 하필이면 활동도 안하고 실력이 낮은사람이라....그리고 개인적으로 이벤트가 더 많았으면 좋겠어요.그리고 어떤 저희 클럽멤버가 제가 실력이 낮다고 어떤사람이 저보고 야!라고 반말을 썼어요. 그리고 바로 그사람이 저희 클럽을 탈퇴했어요 이런사람 게임정지되게 해주세요 부탁드려요"
34547,구글,부정,5,2019,5,12,"해보니까 매크로 , 트롤 하는 사람들이 많은데 신고 기능이 없어서 잡지를 못함. 신고 기능을 만들어서 매크로,트롤 유저를 잡았으면 함. +나 혼자 밸런스문제가 심각하게 생각하나해서 다른 리뷰 봤더니 나만 그런게 아니였음. 밸런스가 한 쪽으로 쏠리면 절ㅡ대 못 이김. 밸런스 조정좀 부탁드림."
34554,구글,긍정,5,2019,5,4,"정말 재미있어요. 싸우고,상자도 열고! 새로운 캐릭터를 얻을떼의 짜릿함! 상대를 죽였을 떼의 통쾌함! 정말 추천합니다. 조금 아쉬운 점은 가끔식 그냥 꺼저요 물론 그렇게 불편하진 안아요.그리고 꽤 단순한 게임이라서 그런지 로딩이 정말 빠르게 됩니다 꼭 해보세요!"
34562,구글,복합,5,2019,5,7,로사 나와서 진짜 잘붙은 껌에 먼지가 붙어서 더러워서 손이 가시지 않는다. 재미도 점차 사리지고 있다. 몰입감은 좋지만 청결함이 없고 정치질만 하는 티밍천만 있어서 무슨 게임인지 모르겠다. 슈퍼셀님은 유저가 지겹지 않게 만든 겜을 원한다고 하다면서요? 무과금유저한테는 너무 컨텐츠 한계가 아닌가 싶습니다. 예를 들어 브롤스타즈 잘하는 사람 빼고 일반인 무과금 유저 보면 진찌 트로피 올리거나 상자 뽑는 영상밖에 없는게 안 쓰럽습니다. 결론은 게임은 좋지만 유저가 조금씩 망치고 있는 게임입니다. 이 문제점 해결하려면 심리학을 이용할 필요가 있다고 생각합니다.
36349,구글,복합,5,2019,4,29,정말정말 좋아요!근데 와이파이가 잘안터지는지 와이파이 빵빵 잘터지는 거실로 가서 브롤스타즈 했는데 그래도 와이파이가 없다고 뜨네요.그래서 위에 봤더니 와이파이가 빵빵 터지는데....그것말고는 정말 최고에요!짱짱!그리고 제가 브롤 어제 깔았는데 오늘 트로피가 120몇개에요!정말 많이많이 주시는것 같아요~브롤스타즈 한번 깔아보는거 추천합니다~이거 깔았는데 브롤스타즈에 중독되버렸어요오~
36351,구글,긍정,5,2019,5,15,"이게임은 정말 재미있습니다.원거리,근거리 다 할수 있고 자기가원거리를 하고십으면 원거리를 할수있고 재미있습니다.브롤을 봤는데 안 깐 사람은 후회를 할 만큼 재미있습니다. 한번 깔아서 해보게요.꿀잼이에요~^^꼭 깔아서 체험해 주세요~^^♡"
36634,구글,부정,5,2019,5,4,데이터 사용 및 와이파이 4칸 다 차있을 때 와이파이 마크 뜨면서 렉 걸림...장난하냐? 그러다 죽은게 수번이다. 게다가 로사로 벨붕 캐릭터는 하나같이 못생겨서 코스튬을 사고 싶지도 않고 컨텐츠도 없고 새로운 이벤트 내놓으면 뭐하냐 결국 움직이고 쏘고 이기는게 끝인데 게다가 렉은(와이파이 마크 안 뜰 때도) 엄청 심하고 솔직히 별 1개도 아깝다 수퍼셀은 초반에 반짝하고 순식간에 파괴되는 별이 될뻔했던 돌이다
36635,구글,복합,5,2019,4,22,이겜 정말 갓겜이에요 !근데 티밍과 주작매치만 패치해주세요 그리고 신규 캐릭터 확륙좀 올려주세요...그거때문에 16개나 모으고 깠는데 아예 안나왔어요...이것도 패치좀... 그리고 레온 패치해주세요 아무리 쎄다해도 은신 10초에서8초 그다음또7초가 돼있더라고요 그리고 브롤 버그판도 누가 만들어습니까 진짜 수레기네요. 그리고슈퍼셀 분들이 열심히 업데이트 신규 브롤러 좀 많이 만들어주세요 그럿게만하면 정말 갓겜 이겠네요. 게임 1위인만큼 열심히 일해주세요!!!!!!!!~!!!!!!!^^
36638,구글,복합,5,2019,5,16,아니 좋긴좋은데 재밌고 트로피 깍는거 심하지 않음 난이도 좀 낮여주세요 클래시로얄 처럼 트로피 30개씩 주면안돼나요 ?? 뽑는 브롤러 확률 높여주세요 그리고 깍는거 이거 2개로 해주시면 안돼요 ??? 아니 트로피 를 차라리 30개씩 1등 이기면 이렇게 해주세요 이걸 보신다면 제발 부탁드립니다 아니저기요 그냥 트로피 30개씩 주면 안돼요..??
36641,구글,부정,5,2019,5,11,브롤러 확률이 너무 낮네요 하하 메가상자6개 까서 신규브롤러가 하나도 안뜬게 .... 제가 캐릭터가 많은것도아닌데 너무하신거 아닌가요 기본상자28개 깠는데도 신규 하나도 안주시는거는 너무하신데 확률좀 올려주세요 팀 밸런스가안맞는데 조정해주시는거 맞나요? 상대는 파워10 이두명인데 저이팀은 파워5가 두명이라서 계속지는데 기분이 좀 더럽고 짜증나네요
36374,구글,부정,5,2019,4,26,팀원 신고기능좀 있었으면 좋겠어요 일부러 게임안하고 가만히 있고 젬그램에서 젬 다먹었는데 앞으로 계속 나가서 적한테 죽어서 적팀 이기게 해주고 그리고 매칭 시스템좀 바꿔주세요 트로피600점대일때 보 만났어요. 초보자랑 고수랑 붙으면 당연히 고수가 이기죠. 제발 좀 바꿔줘요
36376,구글,복합,5,2019,4,16,"업데이트를 하라고 해서 업데이트를 했는데,10번이 넘게 시도를 해도 계속 튕기네요. 그리고 꼭 그 점이 아니더라도 무과금 유저는 브롤러 모으기가 너무 힘들어요. 확률을 조금만 올려 주신다면 감사하겠습니다. 그 2점만 고치면 5점이 만점이라면 5점, 10점이 만점이라면 10점을 드릴 만큼 훌륭한 게임입니다."
36648,구글,부정,5,2019,4,28,저는 이게임을 재미있게 하고 있는데 오류나 튕기는 부분에서 좀 불편합니다. 플레이를 하고 있는 도중 와이파이 표시가 뜰때도 있고 갑자기 게임이 종료되고 있는 상황입니다. 이러한 오류좀 고쳐주시면 감사하겠습니다.
36111,구글,부정,5,2019,4,21,ㅎ 아니 님 말이 되야지... ..하... 내가 주작매칭 때문에 죽겠어요. 시즈팩토리는 점수 더 많이 까여서 빡치는데.. 제가 시즈만5판을 돌렸는데 상대는 다 스타파워있는데 우리는 1명도 스타파워없고. 상대 평균 점수가 4000잠인데 우리는 평균 점수가 2000점 이에요... 고치세요.. 진짜 개빡쳐요.. 진짜 게임 개빡쳐서 지웁니다.
36115,구글,부정,5,2019,5,4,아니 슈퍼셀님 렉안고치나요...렉때문에 트로피도 망해지고 팀원들이랑 친구들한테도 욕먹네요...와이파이도좋고 데이터를켜도 가운데에 와이파이 표시만나오고..렉업데이트되면 다시 돌아오겠습니다...렉 고쳐주세요 렉이 거의 사라질때까진 안하겠습니다..
