ID,STORE,LABEL,SCORE,YEAR,MONTH,DAY,CONTENTS
23219,구글,부정,5,2019,11,2,이게임은 나랑 상대랑 싸워서 죽을뻔 할때 이기면 심장 쫄깃하고 아주 꿀잼이니 바로 다운로드 하세요 저도 안 할때는 노잼이라 생각 했는데 직접 해보니 너무 핵이득이고 꿀잼에다 싫은 점이 하나도 없을 정도로 재밌으니까 스토어에서 바로 다운로드 하세요. 너무 재밌습니다. 1등을 하거나 이기면 정말로 기분도 좋고 이기면 토큰을 주는데 그거 받고 상자를 까서 신규 브롤러 나오면 소리와 기분이 아주 좋습니다.저는 아직6000점인데 이게임을 깔고 1000이나2000점때 브롤러 얻으면 기분이 아~~~~~~~~~~~~~~~~~~주 좋으니 렛츠 브롤~~~~~~~~~~~~~~~~~~~~~~~~~~~~~~~~~~~~~~~~!!!!!!!
23221,구글,부정,5,2019,10,27,아니 게임 만들거면 제대로 만들어야지 와이파이 공유기 앞에 있는데도 레드와이파이가 뜨면 어쩌자는 거야 그리고 서버문제있다고 하는데 다른 사람들은 어떻게 공격하는 거냐고 별한개 주기도 아깝네.
22135,구글,부정,5,2019,11,9,"별이 2점을 준 이유는 1. 레드와이파이 (아니 그거 때문에 겜 망침, 와이파이 되는곳 바로앞에 있어도 뜸 2. 현질유도 (진짜 무료 겜이아닌 현질겜=유료겜) 3. 밸런스 패치 (10000때 니타 쓰는사람 10번 본적있음?) 4. 프로피 보상 (10000이상 넘으면 쓸모 없는 코인350~400개 줌 차라리 안하는게 나음요 여기서부턴 저의 의견입니다. 5. 친선전에서 이벤트 멥 넣어주세요 6. 거의 신캐 나올 때마다 그신캐 너무 사기고 처음엔 신캐만 거의 다사용해서 밸런스패치 해도 운빨겜 됌 7. 배틀그라운드 처럼 신뢰도 넣어주세요(예들 욕을 밥먹듯이 하고 같은 클랜이 아닌 이상 신고 할수없음) 7-1. 트롤러들 너무 많아요 걔네들 경고 주세요 (언젠가는 찾게 될수 있잖아요) 장점에 대해 예기하도록 하겠습니다. 1. 은근 약간의 스릴이 있습니다 2. 걍 재미있고요(플레이 하시면 알거에요ㅎㅎ) 3. 모르겠어여( 성취감? 정도) 끝"
22140,구글,복합,5,2019,11,11,"일단 게임은 타격감도 좋고 재미있습니다. 하지만, 전설 브롤러 획득 확률이 너무 적습니다. 신규 브롤러를 얻은지 4개월이 넘었고,지금 트로피가 10000점이 훌쩍 넘습니다. 하지만 전설이 하나 밖에 없네요. 현질도 했고 상자도 많이 (메가 싱자4개+200개)깠는데 확률이 0.0834이네? 한 0.3은 되야 하지않나요? 점점 새로운 맛이 없고 게임이 지루해져서 할 맛이 떨어집니다. 이 댓글 무시하지 말고 다른 회사들 처럼 답좀 해 주세요"
22491,구글,복합,5,2019,10,30,너무 재밌는데 상점에 크로우하고 메카크로우 올려주세요. 보석 650개 정도요. 아무튼 게임은 정말 잘 만들었네요! 아 그리고 상자까믈 보고 계신다면 전설 1개하고 영웅 1개만 주세용^^~♡ 감사합니다 앞으로도 더욱더 재밌는 업데이트를 해주세요.크리스마스는 크리스마스 버전으로요.사랑합니다!
22493,구글,부정,5,2019,11,5,진짜 게임 육두문자 나온다. 팀전 하는데 상대는 전부 10파워인데 우리팀은 4짜리 6짜리가 있네 그냥 지라고 그렇게 하는겁니까?! 어이없잖아요. 이게 뭐에요. 짜증만 나게 한두번이 아니에요. 계속 그래 하다가 핸드폰 던져버리고 싶은 충동을 느끼네
22494,구글,부정,5,2019,11,16,진짜 타격판정도 이상하다. 1400피 남았는데 700달면 죽음? 그리고 이런 경쟁게임은 타격감이 있어야죠 부쉬때리는 소리랑 파워먹는 소리만 나고 피 달때 어떤 말도 안하네요? 옛날에는 카운트다운때도 소리 났는데;;브롤 망겜다됬네 리스폰될때 말 딱한번하지;; 그리고 바운티에 크로우도 없는데 피는 왜 독처럼 다나요.. 글고 트로피 400개인 브롤러가 있는데 트로피 150개랑 어케 매칭을 해요.. 그리고 와파 빵빵한데서 하고 있는데 왜 와파 없다고 정렉걸림?영자님들도 게임할때 와파없으면 진심 빡치실걸요? 저희도 그러거든요? 와이파이가 조금만 불안정해도 정렉걸리네요? 그리고 내가죽였는데 다른사람이 죽였다고 판정하는 슈퍼셀 당신들은.. 골대에 들어가지도 못했는데 왜 골임? 그리고 벽에 부딪혀도 골인가봐요? 트로피 진척도 보상까지 너무 어렵노 ;;글 브롤러 확률 겁나낮고요 데이터 켜도 정렉걸리면 접으라는거임? 그냥 눈속임이 다인가봐요? 별 0개는 못줘서 1개준다 업뎃할때 그런거좀 상향좀
22495,구글,부정,5,2019,11,16,현질러가 너무 많고요. 업그레이드 비용이 너무 많아요. 그리고 상점에서 사는 캐릭터를 보석으로 주고 사는데 너무 비싸요. 보석으로 사는 브롤러 비용을10% 정도 낮추면 안돼요?
22866,구글,복합,5,2019,10,25,다 좋은데요.... 친구는 브롤러가 20개인데 왜 저는 트로피가 4600인데 왜 캐릭터가 17개 밖에 없죠? 친구는 샌디까지 나왔어요... 저는 초희귀도 2개가 없고 신화도 단 1개도 없어요.. 이거 무슨 차별하는 겁니까?!! 제가 별 3개 드릴테니 브롤러 전설 1개 만 주세요.. 아님 초희귀라도 주세요.... 재발요...이거 때문에 쓸 브롤러도 없고 비교 당해서 짜증납니다.. 1개만 주세요... 제발... 1개만......... 아니 트로피가 거의 5000개가 다돼가는데 초희귀가 2개가 없는게 말이 됩니까?!!. 저 일주일 안해 브롤러 1개라도 안주시면 브롤 지우고 소문내고 악플 달겁니다. 차별하지 마세요.
22872,구글,부정,5,2019,11,21,"다음 업데이트 때 새로운 게임모드가 추가됩니다. 쇼다운입니다. 이름은 공포의 로봇입니다. 가운데에 상자가 20개정도가 있습니다. 독가스는 데미지가 100000000000000000 이정도 입니다.맞으면 바로 죽어요. 로봇은 50개가 동시에 등장해요. 새로운 초 궁국기가 추가됩니다. 초 궁국기는 일반궁국기보다 50%늘어납니다. 8 비트에게 새로운 본능이 추가됩니다. 본능 추가 버튼는 체험바로 옆에 있습니다. 본능에서 추가되는 것은 체력 업이랑 궁국기,사정거리가 업됩니다. 본능을 었는 방법은 상자 바로 옆에 뽑기라는 버튼은 하루에 5번 쓸 수 있습니다. 본능은 99%황율로 나옵니다. 아주 가끔씩 3%황율로 레전드 레어가 나옵니다. 뽑기에서는 종료가 많습니다. 마지막으로 합체버튼이 생깁니다. 합체하고 싶은 브롤러를 선택합니다. 합체라는 버튼을 눌러서 성공확률과 실패확률 있습니다.외를 들자면 레온과 모티스를 합치면 성공확률은 95% 실패확률은 5%입니다. 제가 소개한 브롤스타즈 입니다.끝"
23250,구글,복합,5,2019,11,14,"너무 재밌는데, 트로피 올리기가 좀 어려운건 아닌데, 엠즈, 8비트, 틱은 얻기 힘들어요.. ㅠㅠ 그래도 잼있음 됐죠 뭐! 슈퍼셀 작가님도 대박나세요!"
22144,구글,복합,5,2019,11,17,킹직히 갓직히 다좋습니다. 매일 바뀌는맵 빠르게 추가되는 캐릭터 다좋은데 제발 신고 시스템좀 도입해주시면 안되나요? 브롤스타즈가 팀겜인데 팀이 일부러 자살하면 트롤러는 이분 좋기만하고 그사람이랑 한께한 팀은 크롤러 때문에 점수가 떨어지는게 한두번이 아닙니다. 제발 신고 시스템좀 넣어주세요.
22155,구글,복합,5,2019,10,29,"정말 진심으로 말합니다. 스타파워 없애주세요. 님들 돈 버려고 만드는거 알겠는데 있고 없고가 너무 차이나서 20랭크 이후 부턴 너무 게임이 힘들어요. 더구나 9레벨도 찍기 어려운게 무과금 유저들의 문제점인데. 스타파워 까지 있으면 게임의 밸런스를 붕과 시킬수 있다 생각합니다. 예를 들어 뱀의 초원 맵에서 스타파워를 가진 불과 7렙 불이 만났습니다. 스타파워를 가진 불은 체력이 50% 이하였습니다. 7렙 불은 만렙 불을 잡으면 승리 할수 있었습니다. 하지만 만렙 불의 터프가이 스타파워가 발동됬고. 7렙 불은 탄창을 모두 소비해도 결국 못 잡고 게임이 끝났습니다. 아무리 돈을 벌게 위해, 또는 만렙(9렙)을 찍은 유저들을 의해 주는 혜택이라고 쳐도. 그 하나 때문에 게임을 접는 사람이 생깁니다. 그러니 제발 스타파워를 없애주세요."
22514,구글,부정,5,2019,10,27,몸리쉬 브롤러좀 추가해주세요(체력 4000) (기본공격 650) (특수공격 -) /파일럿의 역량에 따라 효율이 극대화되는 브롤러가 있어야합니다(지금 브롤스타즈엔 그런 브롤러가 없음) /쉽게말해서 어려운 브롤러가 추가되어야함. /기본공격: 길고 얇은 투사체(탄속 파이퍼) 맞출 시 탄 0.5개 제장전 /특수공격: 투사체를 4번 맞추면 매우 짧은 대기시간(0.15sec) 후 점멸(사거리는 니타 기본공격 최대사거리의 70~80%정도) +점수가 오르고 내려가지 않는 모드 추가
22895,구글,부정,5,2019,11,20,"너무 재밌어서 매일 하는게임 인데 요새 브롤러가 왜 않나올까요 .. 미치겠네요 ;; 상자깡 할때마다 나와라나와라 하고 상자를 사도 않나오고, 저보다 트로가 1000이상 차이나는 제동생이 브롤러가 더많은건 뭘까요 ;; ?? 약 한달 전에 이거 올렸을때 딱 하나나오더니 이제서야 또 한개 나오네요 ; 이거 매일 하거든요 비교 안하려 해도 비교되고 ,, 이제 돌겠네요 지금 5천 8개 조금 안되는데 22개 밖에 안되요 ,, 네 비비도 없고요 원래 이런가요 ? ;;"
22908,구글,복합,5,2019,10,29,너무 재밌게 플레이 하고있어요!! 너무재밌어요~친구들한테 추천열심히하고있습니다!!!!! 레온도샀다구요!!!!!!!!!!!!! 근데현질유도가.. 당연히돈은벌어야죠!.. 하지만좀어린친구들이하기엔 현질유도가강해용.. 이게임만들어주셔서감사합니다ㅠ!
22188,구글,긍정,5,2019,11,11,"너무 재미있게 플레이하는 유저 입니다. 딱히 바라는건 없지만 전설 등의 확률,니타의 공격력과 사거리 좀 늘려주세요.이게 제 부게정인데 본게정에는 지금 니타 PP한 1000개 가까이 있을껍니다.앞으로도 신규브롤러와 신규 맵도 많이 추가해 주세요. 슈퍼셀 화이팅!!!!!!!!!!!!!!!"
22535,구글,복합,5,2019,11,16,"요즘 브롤 아주 재밌게 하지만 이거하나만 개선좀 부탁드립니다. 쇼다운 게임모드를 먼저 깐놈이 임자라는 모드를 하나 추가해주세요. 말그대로 큐브상자를 먼저 까기만 하면 즉시 그큐브가 본인것이 되는게 룰입니다. 초반에 스폰운이 없는데 체력이 많지않은 타라나 제시, 발리, 쉘리 등은 상자앞에 앨프리모, 불 같은 브롤러들이 뺏으려 접근하면 그냥 뺏기고 죽는게 현실입니다. 안된다면 아에 상자가 존재하지 않고 순수 실력으로만 싸우는 모드도 있으면 좋을것같습니다."
22536,구글,복합,5,2019,10,30,다른건 다 좋은데 레드 와이파이와 상자 확률이 좀 안 좋음... 솔직히 와이파이 빵빵한데 갑자기 레드오이파이떠서 죽음 (슈퍼셀에 특징인가?) 그리고 브롤볼엔 트롤러들이 트롤을 밥 먹듯이 함. 신고 기능을 만들어주거나 트롤을 밴 시켜야 게임이 진행이 될것 같다. 나머진 다 좋음
22541,구글,긍정,5,2019,11,17,초딩게임ㅋㅋ 컨트롤과 상관없슴. 해보면 왜 초딩게임인지암 ㅋㅋ 적어도 이동하면서 총쏘면 명중같은거 떨어지던가 ㅋㅋ 케릭들 이속도 똑같고ㅋㅋ 앞으로가면서 총은뒤로쏴지고 ㅋㅋ 개발자가 애인가 ㅋ 지적능력이 떨어지나 ㅋㅋ
22547,구글,부정,5,2019,11,21,"게임 자체는 제밌는대요.... 랜덤큐하면 트롤,가만이 있스면서 터랫처럼 공격하는개 뭡니까?... 유신고기능 넣으라고.... 그거 넣는개 힘드냐? 슈퍼샐 수듄;; 래드와이파이도 고치세요... 쫌!!! 맟춤법 틀리니까 기분나쁘지? ㅋㅋㅋ 매롱👅"
22548,구글,부정,5,2019,11,21,"악의적인 트롤들도 많은데, 단순히 브롤상자작 하려고 게임 들어와서 제자리에서 공격키만 매크로 돌리는 사람이 너무 많습니다. 정말 말그대로 스폰자리에서 공격키만 몇초에 한번씩 누르면서 자동 강퇴를 안당합니다. 제발 신고 좀 가능하게 해주세요."
22927,구글,복합,5,2019,11,3,"근데 이거 무슨 기간까지 보석 10~30개를주거나...스타파워도...그리고 뭐 그렀면 좋겄어요!그리고 캐릭터도 잘 안나오는데 나와게는 해주세요!(대형상자,브롤상자)등등에서는신화~영웅까지 해주세요감사합니다"
22937,구글,부정,5,2019,11,16,아놔.....! 겜하면서 후기 쓰는건 또 처음이네! 아니 뭔 업그레이드를 전설 스파이크를 아주 그냥 쓰레기 만들었네! 무슨 생각으로 업그레이드 한건가요? 별 한개도 아까비! 어쩌다 좋은 캐릭이 있다는게 스파이크가 전부인데 올인해가지구 겨우 스타파워 생겻는데 커브볼이 완전 직선타랑 차이없네? 각도를 너무 심하게 조정한거 아님? 거기다가 빨간 와이파이가 계속 뜨면 이건 뭐 놀아라는건지 말아라는건지 모르겠음!아님 다른 캐릭 좀 뜨게 해주든가......참 어이가 없네!
21768,구글,복합,5,2019,11,21,"이 게임 재밌습니다. 재밌는건 인정하는데 하지 마세요. 통칭 레드와이파이(네트워크 불안정) 이거 하나때문에 유저들 몇천 몇만이 게임 접고 돌아서는데 이 레드와이파이가 처음 발생해서 유저들이 불만요청한 것이 벌써 약 12개월 전쯤인데 이 개발자분들은 이 레드와이파이에 어떠한 대책도 내놓고 있지 않습니다. 저도 노력을 해보겠다고들 해서 믿고 12개월동안 플레이한 유저들 중 한 명입니다만. 아직까지도 이 점은 고쳐지지 않고 있습니다. 와이파이가 4칸, 즉 최대치로 설정 들어가서 와이파이 상태 점검까지 해보면 다 정상이라고 뜹니다. 하지만 이상하게도 이 게임만 들어오면 네트워크가 불안정하다며 빨간색 와이파이 모양이 뜨며 게임에 다시 제대로 임했을 때에는 이미 패배 라는 단어가 올라와 있습니다. 그럼에도 불구하고 12개월동안 즐겼다가 패치 되지도 않는 이 레드와이파이 때문에 이제 너무 지쳐서 접습니다. 이만 줄이겠습니다."
22214,구글,복합,5,2019,11,17,"다 좋아요.. 하지만 밸런스가 안 맞아요.. 로보럼블을 하는데 제가 6000이상이거든요..! 근데 팀원들이 800,1200 이 되고, 다른 것 들은 상대가 10000이상, 8000이상 이되요... 밸런스가 너무 안 맞아요 레벨도 거의 대부분상대들의 브롤러가 만렙 이고요... 팀원들은... 만렙도 아니고 더 8000점대..? 원래그런가요..?"
22575,구글,복합,5,2019,10,24,"(1) 와이파이 바로 밑에서 하는데 레드와이파이가 뜬다 (시즈모드,듀쇼다 400점대) (2)밸런스가 안 맞는다 (무슨모드를 하던 브롤은 거의 팀전입니다 근데 우리팀은 상대팀의 비해 레벨,실력,점수,상황판단이 낮습니다) (3)티밍 (슈퍼쉘 측에서 티밍은 전략이다 라고 말하셔서 점수가 100점대에서도 티밍이 자자합니다) (4)브롤러가 안나온다 (소과금,무과금 유저들에겐 전설,스타파워를 얻기 힘듭니다) 제 상황: 최근들어 접을까? 라고도 생각했었지만 이런 갓겜이 어디 한 둘이겠습니까 요즘 브롤을 부쩍 많이하는데 어째서인지 트로피는 많이 하락되어 있더라고요 슈퍼쉘 관계자님 트로피가 하락되지도 얻어지지도 않는 유저들과 함께하는 모드도 만들어 주시면 어떨까요 게임은 무슨게임이든 단점이 있죠 이것을 계속 내버려두면 언젠가 유저들은 다 떠나길 마련입니다 이글을 비하하는 글이아닙니다 피드백이죠 이런 갓겜 만들어 주셔서 감사하고 번창하세요~"
22951,구글,복합,5,2019,10,31,"크로우 반드시 너프 20프로 이상가야만 해요 크로우 때문에 짜증나는 것 같아요. 크로우 너프 믿습니다. 그러나 트로피 수정 및 맵 추가or삭제 는 좋은데, 도적금고나 뼈 터널이라는 하이스트 2개의 맵 및 바운티 선인장함정 및 바위요새라는 바운티 맵입니다. 하지만 최소 1개라도 이런 것은 했으면 좋겠습니다 모두 즐겜하시길 바랍니당~~~"
22952,구글,부정,5,2019,10,26,"아니,상자를 107개열었는데 비비 한 개 밖에 안나오는건 너무하잖아요. 전설은 기본인데 전설 하나도 안나오고.현질해서 얻으라는 거에요? 또, 엠즈 삭제해주세요 그냥 삭제! 트로피6300대인데 엠즈때문에 듀오를 못해! 빨리 삭제안하면 존망겜 된다. 캐릭터 존망겜,현질 존망겜,티밍 존망겜,와이파이 존.."
22953,구글,복합,5,2019,11,3,솔직히 다 좋은데요 매칭도 요즘에 너무 느려지고 트로피 높은사람이랑 같이 팀플돌리면 너무 잘하는사람이랑만 되고요... 무엇보다도 상자 확율이 너무 낮아서 브롤러가 요즘 너무 안나와요...그리고 분명 와이파이는 빵빵한데 랙도 너무 걸려요
22224,구글,복합,5,2019,11,11,정말 너무 재미있습니다!!!!!제가 슈퍼셀 계정 연동해서 지금 컴으로 리뷰쓰고 있는데 이벤트도 정말 다양하게 나오고 또 브롤러를 뽑았을때에 그 쾌감 까지 완전 좋습니다!!!하지만 고쳐야할점이 하나 있습니다. 와이파이공유기 바로 앞에서 게임을 해도 레드와이파이가 쉽게 뜨고 잘 튕기기 때문이죠!!! 또 제가 불과 엘프리모가 스타파워가 없는 상태로 20랭크까지 올렸는데 스타파워가 있는 상대와 매칭이 되서 멘붕이 올때가 있었습니다. 고칠점 을 밑에 2가지로 띄어드릴테니 참고해주셨으면 합니다!!! (참고: 초등4학년11살/트로피 8065/브롤러들:26개) 1.레드와이파이 2.스타파워가 있는사람 없는사람 따로 매칭 시키기 감사합니다!!! 답변 꼭 남겨주세요!!!
22583,구글,부정,5,2019,11,15,게임 하는건지 않아는건지 게임실행만 하고 가만히 있는 중국 넘들 신고 못하나요? 신고기능 없나요? 게임 시작하면 않움직이고 시작하는 그자리에서 적이있든없든 공격만 하는데 이거 게임도 않하고 가만히 레벨 올리는 중국 넘들 신고할수 있게 해주세요 닉네임 夏天 이넘
22962,구글,복합,5,2019,11,16,다 좋고 만족하는데 다만 이동조이스틱이 한 방향으로 고정되서 혼자 가는 버그를 고쳐주세요수시로 그렇게 되서 게임 자체를 하기 힘들어요 스트레스도 받고요 빠른 시일내에 고쳐주시길 바랍니다^^
22966,구글,부정,5,2019,11,1,통신 상태나 고쳐라. 이길 수 있는데 중요한 순간에 통신오류 나서 지면 꼭지 도는거 늬들도 알텐데? 5G로 해도 이렇게 되면 말 다했지. 스킨 내지말고 통신이나 고쳐. 존댓말로 하려해도 할 수가 없네
22973,구글,복합,5,2019,10,26,"일단 레드와파 문제는 당연 하고요!제가 브롤볼을 도는데 제 트로피가 반올림해서 8000점대인디 브롤 볼 같히하는 사람들의 트로피는 500대더라구요.그래서 지가 이거 버그인가 문의도 시도해보앆지만 아무 반응이 없었고 밸런스와 확률좀 높여주세요!제가 전설 얻을 수 있는 확률이 0.1257인데 대형상자 21개랑 브롤상자 120깨를 헀는데도 아무 것도 안되더라구요.제발 확률좀 up!아그리고 아무이유 없이 튕길때도 있고~ 파이퍼나뭐 특수공격이 하늘로 올라가서 내려 가는 특수공격이 있는 브롤러들은 독가스로 하면 바로 대미지를 입더라구요 그냥 걸어가면 독가스에 닿아도 뭐 1초 정도뒤에 대미지를 받는데 이동기 궁 때문에 벌써 죽은 23번이 넘네요 이것도 수정해주시고요 제가 7900점이서 얼레 신규 브롤러가 생기기전에는 메가상자로 주고받곤 하잖아요 근데,그 8000점때 얻을 수 있는 브롤러가 생긴 뒤에 메가상자를 못 얻었어요!틱이 생겼을 때도 이와 같은 현상 이였고요! 수정 좀 합시다^^"
21823,구글,부정,5,2019,11,16,고쳐주시면 좋겠는 거 1.레드 와이파이(와이파이 빵빵 터지는데 렉) 2.신고 기능(예를 들어 브롤 볼 같은 데서 자살 골 넣는 그런 트롤 플레이어들 신고 필요) 3.개인적인 소견으로 리플레이를 보려면 브롤러 400트로피를 가야되는게 좀 아닌 것 같네요.굳이?자신이 잘한 경기를 보고 싶은데 트로피가 안 되면 못 보는게..ㅡ 참고로 저는 9500따리 플레이어입니다. 고쳐주시면 감사하겠습니다. 제발 ..
22237,구글,긍정,5,2019,11,8,"어후 너무 재미있습니다. 리뷰보고 깔아봤는데 이렇게 재미있을 줄은 몰랐습니다. 저는 제취향게임 찾는게 너무 어려웠는데 브롤스타즈,,바로 이 게임 덕분에 오랜만에 게임 성취를 느끼고 만족감, 재미 등,,을 동시에 느꼈습니다. 이 게임 다운로드 안하셨다면 한번 해보시기 바랍니다. 저 처럼 반할 확률이 높을 것 같습니다. 제가 왠만하면 리뷰 안남기는데 이건 남겨야 할것 같아서 남겨봤으니 안깔아 보셨다면 꼭 시간날 때 깔아보시면 좋을겁니다."
22603,구글,복합,5,2019,11,3,모바일 슈팅게임으로 현질상관없이 실력으로만 랭커가 될수있는 좋은게임입니다. 업데이트도 많이해서 브롤러 추가되는 것도 좋고...그런데 레드와이 때문에 재미없다는 분들도 계시는데 모바일 데이터쓰시지 마시고 집에서 와파 잘통하는데서 해야되여 왜냐면 전세계 사람들이랑 하는 게임이라..그러니 브롤이 이상한게 아니라 와파가 잘 안통하는 거에여 어쨌든 갓겜.. 생일때 현질 5만원 쯤만 하면 전설 나올 확률이 ..30퍼쯤?? 트로피 전척도 보상으로 주는 브롤러들만 써도 트로피 10000은 가뿐해요. 현질유도는 별로 안하고 시간 남아돌때 하기 좋은 게임. 트롤 때문에 기분 나쁘시다면 솔로쇼다운 하시는게 좋을거에여 그리고 제 생각으론 한 브롤러만 키워가지고 트로피올린다음 못하는 브롤러들 트로피 올리는것보단 골구로 올리시는게 좋아요 한랭크씩 초딩게임이라지만 성인들도 재밌게 즐길수있어요 꼭 받으셈 강추!! ^^~!!!! (참고로 전 현질러^^)
22983,구글,부정,5,2019,10,26,아니 순간 랙걸리면서 상대는 순간이동 하고 우리 팀은 스타파워 없고 상대만 있고 그리고 또 스타파워만 있는 유저만 맨 아래 맵이 이있어서 현질 한사람만 좋고 아니면 현질안한 사람은 못해 현질한사람을 더 현질하라고 하고 현질한 사람만 좋게 만드는 거잖아 돈에 환장 했내
22991,구글,부정,5,2019,11,1,"내 캐릭터는 6,7,8 레벨인데 매칭돌리면 상대들 스타파워가 대부분. 매칭시에 밸런스도 안맞고 캐릭터간 밸런스도 안맞으니 결국은 신규 유저들은 다 떠나고 고인물들만 남게 됨. 게임 종종 와이파이가 풀인데도 불구하고 렉걸리는 현상도 일어남. 최악."
23008,구글,복합,5,2019,11,3,다좋은데 밸런스가좀 아쉬워요 쉘리와 로사는 사거리가 너무길고 크로우는 독 짤짤이가너무 길어요. 그리고 하필죽기 직전에 느껴지는 건대 공격이 느께 되요. 그리고모티스버프좀...
23010,구글,복합,5,2019,11,4,진짜진짜 핵꿀잼이고요 현질러 만나도 실력만 있으면 되기때문에 그런 걱정없어도 됩니다! 계정한번 날라갔는데 복원됬습니다! 슈퍼쉘아이디 만들면 발리스킨주니 만드시는걸 추천드리구 생각보다 캐릭얻기가 좀 어렵더라구용(전설)물론 전설이긴 하지만요(찡긋) 그래두 진짜 꿀잼이구 계속업데이트되니 진짜 추천꼭추천드려요! 슈퍼쉘 짱입니다!사랑해융! 별 100개는 물론 무한으로드리고 싶네용
22287,구글,긍정,5,2019,10,30,브롤스타즈 최고 입니다 속도는 느리게 걷는데 상자를 열어는데 비비 보다 레온이 먼저나왔었요 아니 그래서 게임 개속 하는데 비비 나왔어요 슈퍼셀 이 본것 같아요 최고예요 (*~*)(☆~☆)(♡~♡) (^~^)(@~@)(>~<)~~~~~~~~~~~~!!!!!^^~~ (₩~₩)(&~&) 애들은 노잼 이랫는데 저는 꿀잼 이얘요
22648,구글,부정,5,2019,11,9,1.파워모드9렙해주서!!!!!!!!!!!!!!!!!!!! 어그러이까유트버가안나는게에요어지그어짜쯩나게!!!!!!!!!!!!! 2.어게임아에짜쯩나팔비트버프소도너무느려요소도39정도해야해어엠즈너프너무사기구이쎄요크로우어!!!!!!공격하방79저도요어
