ID,STORE,LABEL,SCORE,YEAR,MONTH,DAY,CONTENTS
35557,구글,복합,5,2019,4,28,"님들 근데 막 전설 신화 안 나온다고 불평하지 마세요. 운이 안 좋은 걸 어떡합니까? 저는 트로피 2600 땐데 스파이크에 모티스 진 뽑았습니다. 제 친구도 레온하고 모티스, 진 있고요. 물론 확률이 낮은 건 사실이지만 확률이 높으면 모든 사람들 브롤러 다 있고 그럼 재미가 있습니까? 저는 진짜 불평 안 하셨음 좋겠네요...글고 님들 팀이 잘못 걸리는 걸 어쩌라는 거지? 슈퍼셀이 어뜨케 해결해 준다고... 다시 한 번 말 하지만 님들 운이 안 좋은 겁니다. 브롤 갓겜!!! P.S.전 와파 문제 없는데요."
35254,구글,부정,5,2019,4,30,로사 캐릭터 때문에 캐릭 밸런스 하나도 안맞다ㅡㅡ 만들기전에 각 종류 경기마다 어떤 영향을 미칠지 생각하고 만들었는지..... 로사 무조건 밸런스 낮춰라 로봇대격돌엔 궁쓰면 자기가 몸빵으로 달려오면서 혼자탱크랑 1대1로 싸워 이기더라 다른 경기종류도 마찬가지고..... 로사 때문에 전부 다른캐릭터가 다 가치 떨어진다 로사 1렙이 5000체력에 초당데미지가 1440 말이되는지 ㅡㅡ 궁은 80퍼 데미지 방어하고. 개발자분이 어떤 생각으로 캐릭터 밸런스하나도 생각 안 하고 만드시는건지 바로 밸런스 패치 부탁합니다
35255,구글,부정,5,2019,5,21,"일단 갓겜인 이유 1.개성있게 잘 표현해놓았다 브롤러마다 스킬이 잘 겹치지 않을 뿐더러 생긴 것 또한 각기 다르게 생겼다 2.맵이나 모드가 많다 맵을 구성을 잘 해놓았고 배틀로얄,축구 등 여러 모드들을 즐길수 있다 3.상점시스템 보석으로 살수 있는것들이 많이 올라오고 브롤러들도 상점에 여러가지로 잘 뜨고 가격도 적절하다 망겜인 이유 1.신고 시스템 배틀로얄 시스템이 운영되려면 적어도 신고 시스템은 있어야 한다. 지금 브롤스타즈에는 티밍이 넘치고 넘쳤다.또한 자신의 팀이 탈주,자살골,트롤링을 할때 신고는 해야하지 않겠는가? 2.현질유도 일단 운이 좋다면 괜찮겠지만 확률이 조금 극단적이다. 초희귀브롤러가 확률이 1~4%수준이다. 이건 거의 클로 전설수준 아닌가? 클로에서 아레나 10이상인데 전설 없는 사람은 거의 없을거다.그만큼 확률이 극악이라는거 3.팀매칭 이게 제일 최악이다 롤에서 우리 야스오 보는것보다 더 심각하다"
35564,구글,부정,5,2019,5,7,제 아주아주 주관적인 생각인데요. 제 주변에 많은 사람들이 브롤스타즈의 신규캐릭터 로사 때문에 밸런스 붕괴를 겪고있는것으로 알고 있습니다. 이를 보완하기 위해서는 로사가 특수공격을 썼을 때 이동속도를 감소시키고 기본공격의 관통을 없앤다면 기존의 캐릭터들과 밸런스도 잘 맞고 게임 플레이의 재미도 더 올라갈것같다고 생각합니다. 이상으로 저의 아주라주 주관적인 의견이었습니다.
35568,구글,부정,5,2019,5,14,아니 왜 이렇게 매칭이 이상한거죠? 저랑 친구들은 다 12에서13 랭크 인데 상대방은 평균은 3백 얼마고 100점넘게 차이나는데 어떻게 하라는 겁니까? 거기다가 상대방은 스타파워 까지.. 정말 가관 이네 가관... 이걸거면 진짜 게임 만들지 마시죠. 수퍼셀 수고하세요
35571,구글,복합,5,2019,5,21,"LTE인데도 불구하고 네트워크 지연 현상, 렉 같은건 다 참아줄수 있다 칩시다. 근데 매칭시스템이 너무 벨런스파괴임. 이제 캐릭뽑아서 시작하는데 상대 만렙스타파워달린놈으로 매칭하는건 뭐냐? 그렇다고 트로피 4000따리가 7000 따리잡히는 일도 빈번. 이도저도 아닌 순수 브롤러 트로피로 매칭잡아서 이런 사태가 나는거임. 최소 브롤러 레벨 및 총 트로피로 매칭 시스템 개선이 필요함."
35576,구글,긍정,5,2019,5,4,최근 업뎃 이후 앱실행시 로딩화면에서 전환 되는순간 앱이 종료 됩니다 그리고 다시 앱을 실행해야 정상 가동이 되네요 어떨때는 로딩 화면 끝난후 화면 전환 되면서 폰이 멈추네요 폰은 노트9이고 다른 앱은 문제 없는데 유독 이 앱만 그럽니다 것도 최근 업뎃이후부터 그러네요
35865,구글,부정,5,2019,4,20,"이게임도 재밌네요.이글이길어서 다는못일겠지만 한번다읽어보세요!!! 일단이게임 업데이트는 다 핵 개꿀인것같아요.그리고 별은5개 좋은점:개꿀잼,동생과친구들,아빠랑같이플레이하면 더핵잼,트로피많이주니 개꿀 !!! (중간 오타주의) 아무튼 개꿀잼이네요!!!"
34951,구글,부정,5,2019,4,26,5000점 중반 대 유저입니다. 게임은 전반적으로 마음에드나 왜자꾸 매게임마다 새로운 캐릭터 로사랑 매칭되는지 모르겠습니다. 로사는 보통 30점 미만으로 제캐릭 점수대랑 너무 차이가 납니다ㅜ 캐릭 트로피 평균내서 매칭된다지만 실력차도 너무나고 상대던 우리팀이던 못하는 사람과는 매칭 안되었으면 좋겠습니다 암걸릴 것 같습니다.
34961,구글,부정,5,2019,4,19,신고추가!!!!!!!!!!!!!!!!!!!!!!!!!!!!!!!!!!!너무짜증나는데요 트로피를 낮추려고 젬 그렘 에서 공격만하고 안움직이고. . . 제가 테블릿으로 하는데 너무 양심이 없네오.. . . 게임을 1분 간 안하면 강제추방 하고 매칭 돌리는 사람을 넣어서 계속 하는것 이 좋다고 봅니다 (그것말곤 다좋아 별3개) 아! 티밍방지로 근접케릭이 아닌 이상 기준을 정해 가까이붇으면 죽이기 그리고 제발 맵만들때 뻥 뚤린 맵 으로 만들지마요 (티밍 하기 딱 좋은곳)
34965,구글,복합,5,2019,4,26,분명히 게임성은 좋습니다. 하지만 새로나온 로사라는 캐릭터의 특수 공격이 너무 밸런스가 안맞는것 같습니다. 브롤 볼에서도 그냥 특수공격쓰고 달려가면 골이 넣어지고 잼그랩 카운트다운에서는 보석만 먹었으면 궁쓰고 도망가니면 아무도 못막습니다.
35260,구글,복합,5,2019,5,5,게임자체는 재밌고 할만하지만 온라인 게임에 신고기능이 없다는것이 대단합니다. 잠수유저나 트롤유저 혹은 버그를 쓰는 유저들을 모두 신고없이 잡을수 있다 생각하십니까? 게임다운로드 수도 5천만 이상으로 많은 인기를 끌고 있음에도 불구하고 신고기능도 없다는것은 그럴만한 이유가 있기에 없는것이겠죠? 저번에 별 두개 줬었는데 방금 플레이 하면서 별 주는거 자체가 아깝다는 생각이 들어서 다시 리뷰합니다. 게임을 아무리 좋게 만들었다 한들 하는 사람들의 편의를 봐주지 않으면 잘만든 게임이 아니라 생각합니다. 와이파이 5칸 다 떴는데도 불구하고 인터넷접속 불안정은 고쳐지지 않고 신고기능은 많은사람들이 문의하는데도 불구하고 절대 만들어주지 않는데 그러면 패작러들과 티밍은 잘한다는 것입니까 다른 회사의 배틀로얄 pc게임에서도 티밍은 늘 언급되는 문제점이고 계속 제지하고 전세계적으로 인기있는 lol에서도 패작러는 제재를 주는 상황에서 왜 이 게임에서는 모든게임의 기본적인 신고하기가 없습니까?
35584,구글,복합,5,2019,5,3,게임이 간단하게 즐기기 좋고 그래픽도 좋습니다. 또한 캐릭터도 개성있는게 좋았습니다. 다만 무과금유저는 캐릭터 얻기와 레벨올리기가 힘듭니다. 또한 쇼다운 티밍 문제가있습니다. 그리고 게임내 고의트롤 유저 신고기능이 생기면 좋겠습니다.
35605,구글,부정,5,2019,4,29,로사라는 신캐릭터가 나오고 갑자기 싼가격에 확풀더니 지금 밸런스 완전 붕괴됨 죄다 로사만 하려고하니 큐도 잘안잡힘 마치 이벤트템 잘못풀었다가 걷잡을수없이 밸런스깨져서 망했던 게임 몇몇 표본들의 길을 걷고있는듯한 느낌. 점점 유저들은 질리기쉽상이고 떠나기마련. 얼른 확실한 너프를 시키든 뿌린걸 거두어야 브롤스타즈가 게임 업계에서 생존할 수 있을거라 전망됨. 요즘 나도 재밌게 하던 유저였지만 점점 손이 가지 않는게 현실.
35606,구글,부정,5,2019,5,17,아니 열여덟.. 시작할때 튕기고 게임도중에 와이파이모양에 느낌표 뜨면서 끊기고.. 열여덟!! 게임을 어떻게 하라고..고칠생각 안하나? 아침(조)또 열여덟... 웬만하먼 안쓰는데 짜증나서.. 그리고.. 나도 득본게 있어서 말 안할랬는데 랭크매치업도 개판이고..게임을 만들기만하고 신경을 안쓰는듯
35608,구글,부정,5,2019,5,11,별0개주기도 아까움. 버그란버그는 다 있고 버그판보다 정식판이 버그가 더 심함 렉은 다걸리고 리코사거리는 제시한테 않되는데왜 제시 사거리가 리코한테닿냐고요. 그리고 빨간 와이파이 표시머임 그리고 브롤러8게인데 상자60게 열었는데 왜 아무것도 없음? 똥퍼셀아니 개퍼셀. 정신 차리세요.그리고 왜 토큰 20게 남아있는데 왜 토큰 못얻냐고 그리고 로사 너프는 한거 맞음?그리고 레온은 또 왜 너프냐고 현질을 할때도 현질 했는데 돈만 날라가고 보석 없냐고 조이스틱 조정도 잘 않되고 공격 했는데 왜 공격 않한걸로 함? 랙걸려서 아무것도 못하고 제정신임?칼이랑 붙었을때 칼이 마지막으로 부매랑 던지고 죽었는데 왜 나한테 데미지들어와! 그리고 칼 궁썼을때 왜강물건넘? 해명 하세요.너프도 제데로 하고 현질도 관리하고 버그수정 하라고요!제발 제정신으로 하세요!제발 게임 관리 하라고요!!!!!!!!! 개퍼설!!!!
35036,구글,복합,5,2019,5,12,"게임 너무 재밌고 다 좋은데 렉이 너무 심해요😭 도저히 게임 진행이 안될때도 너무 많고, 와이파이를 끄고 데이터로만 해도 와이파이가 안잡힌다는 경고 그림이 뜨면서 캐릭터가 혼자 뒷걸음질 하기도 하네요..T.T 게임 안정에 신경을 써주셨으면 좋겠어요."
35330,구글,부정,5,2019,4,23,1. 최근 업데이트 후 갤럭시s10 에서 게임을 키자마자 앱이 죽어버리는 현상이 무조건 나타납니다. 두번째 게임을 키면 정상으로 켜지구요. 2. 배터리 소모량이 급증한다는 경고도 자주 발생합니다. 3. 와이파이에서 게임 불가할정도로 끊김현상 있습니다. 갤럭시 s10에서 충분한 테스트 후 수정 바랍니다.
35337,구글,부정,5,2019,4,29,슈퍼셀님 재밌게 플레이하는중입니다. 희귀 캐릭터 로사라는 캐릭터가 너무 효능이 좋아 벨런스가 맞지 않습니다. 왜 이캐릭터가 너무 효능이좋은이유는 특수공격이 빨리 채워지고 특수공격을하면 사실상 무적이기 때문입니다. 그래서 대부분 사람들이 로사만쓰거나 로사를이길 캐릭터는 사실상 로사만있어 로사를 너프시켜 주시면 감사하겠습니다.
35340,구글,복합,5,2019,4,27,조이스틱을 좀 부드럽게 해주시고 그리고 장기간 입력 없으면 튕기는 건 뭔 생가으로 만든거죠? 다시 들어갈려하면 해당 전투가 끝나야 들어갈 수 있다하고 그냥 게임을 하지를 말라는 건가요? 그리고 이건 제 개인적인 의겨인데 처음에 깔았을 때는 재밌어요 근데 갈수록 질려요
35345,구글,긍정,5,2019,5,21,재미있긴 한데 솔로 쇼다운할때 다른 플레이어랑 너무 가까이 스폰되는것 같지 않아요? 근처에 상자가 없어서 상자 파밍하러 가면 다른 플레이어를 너무 당연하게 만나는데 그렇다고 파밍 안하고 숨플하긴 비겁해보이고....... 솔로 쇼다운 할 때 다른 플레이어와 조금 멀리 스폰 되었으면 좋겠어요.
35346,구글,복합,5,2019,4,30,슈퍼셀 계정 로그인 방식이 불편해요.네이버 아이디로 개설 했는데 네이버 아이디를 해킹당해서 로그인이 불가능한 상태입니다.그런데 이메일로 인증번호를 받는것 외의 다른경로로의 로그인 방식이 없는것 같아서 불편한것같습니다. 다른 경로도 만들어주세요.
35350,구글,복합,5,2019,4,24,아니 재가 전투에서 토큰 모아서 상자를 깔려고 했는데요. 근데 갑자기 재가 죽어가주고 다시 전투를 돌렸는데 재가 1등을 했는데. 토큰이 안모아지 더라구요.... 재가 사람 엄청 죽였는데... 나갔다가 들어왔다가 해야되지 토큰이 모아집니다.... 저기 운영자님. 보고 있으신다면 빠른 답변 부탁드립니다.
35043,구글,부정,5,2019,4,24,신고버튼이 절실해요. 스샷까지 찍었네요 짜증나서. 가만히만 있길래 끝나고 보니까 최대3천트로피인게 현재 1400입니다. 모든 챔프들 다 보니까 13랭크에 챔프트로피는 77이네요 거의 모든 캐릭터들이. 뭐겠어요? 패작이에요. 이거를 조치를 할 수없으니까 이런애들이 판을 치죠
35352,구글,부정,5,2019,4,28,아니 빅브롤러 니타하고 제시 너무쎄고 이거깨는 것 도힘들고 시간설정도 이상하게해서 어떨땐이기고 어떨땐지고 이게슈퍼셀이에요? 이대로 가면안됀다고 생각합니다. 그리고 신캐 피해를80% 줄이는건 아닌거같아요.어떻게 100대미지가 들어가수있나요? 말이돼요? 대규모패치전에 이거고쳐주세요. 진짜빅브롤러좋와하는데..
35353,구글,부정,5,2019,4,26,1. 왜 와이파이에선 자꾸 끊기나요? 와이파이 종류에 관계없이 계속 끊기네요. 개선이 전혀 되지않고있네요 2. 최초 접속시 튕김? 현상이 지속적으로 발생합니다. 첫접속시 로딩이후 바로 튕김. 두번째 곧바로 재접속하면 들어가짐. 이거 어떡해야하나요?
35358,구글,복합,5,2019,5,11,하면서 너무 재미가 있어요 근데 진짜 진짜 3년동안 브롤 상자나 대형상자 에서 브롤러 가 나온적 이 진~~~짜 없습니다 ㅠㅠㅠ 게임 시작할때 쯤 에 2개 밖에 브롤러가 안 나왔습니다 ㅠㅠㅠㅠㅠ 이 게임을 관둘 정도로 심각하게 브롤러가 나오지 않아요......하....
34757,구글,부정,5,2019,5,18,"전 초딩인데요 초딩 구글 계정은 댓글도 못달게 되있어서 엄마계정으로 올립니다 전 닉넴:전민기 트로피:4700 으로 게임을 하고 있었는데 3가지 이유로 게임을 접습니다 1.티밍:그래도 좀 개선된 부분 중 하나지만 그래도 일부 맵 애선 좀 심합니다 2.로사:솔직히 로사 나오고부터 배런스가 붕괴되면서 일부모드(쇼다운,브롤볼,시즈팩토리) 가 지루해지기 시작해습니다 3.트롤:팀에 트롤이 있으면 질 확률이 너무 높습니다. 이 세가지만 개선해 주세요"
34766,구글,복합,5,2019,5,5,브롤스타즈 정말 재밌고 신나는 게임 입니다. 하지만 게임도중에 계속 튕기는 경우가 있어 불편하네요 완벽하지만 튕기는것 하나가 문제 입니다. 이거 어떻게 하면 될까요. 이 게임(브롤스타즈)정말 재밌지만 게임이 튕겨서 짜증날때가 많습니다. 이 문제 저만 그런게 아니라 제 친구들도 그럽니다. 그리고 핸드폰이 좋은 친구까지 튕깁니다... 이 문제 고칠 방법이 있을까요?
35057,구글,복합,5,2019,4,24,네트워크 개판이고 밸런스 똥망. 특정 맵에서는 특정 브롤러가 유리하다고 하는데 이 유리하다라는 게 정확히 뭐냐면 맵만 잘 맞는 브롤러 하나 있으면 상대 3명을 아무것도 못하게 만드는 수준을 말한다. 즉 브롤러 많이 가진 놈은 맵 바뀔때마다 브롤러 바꿔가면서 연승가능하지만 너가 브롤러가 많이 없는 뉴비거나 라이트 유저라면 그들에게 쳐맞으면서 손도 못 쓰고 연패해야한다. 뉴비는 초반에 할 수 있는 모드도 얼마 없는데 여기에 맞는 브롤러도 없어서 계속 연패하는 거다. 만약 운좋게 맵에 맞는 브롤러가 나와서 연승한다? 이 게임은 브롤러마다 트로피가 개별적으로 돌아가고 이 트로피에 따라 매칭이 갈린다. 즉 고인물도 브롤러 새로운거 잡으면 뉴비랑 매칭이 잡히는 매칭구조다. 그래서 뉴비가 연승해서 브롤러 랭크5만 넘어가도 다른 브롤러 수천판씩 하다가 심심해서 안쓰던 5랭 브롤러 잡고 온 고인물과 매칭이 붙어버린다. 당연히 연패는 당연하지. 매칭/밸런스 모두 뉴비를 전혀 배려하지않는 구조
35065,구글,부정,5,2019,4,16,"4월 업그레이드 한 후에 렉이 너무 심해졌어요. 움직임이 버벅거리고 멈추는 현상이 나타납니다. 덕분에 쇼다운에서 꼴찌를 5번중에 3번이나 했어요. 어떻게 글을 써야되나 했는데, 너무 심해서 이렇게 글을 남깁니다. 트로피 돌려주시길 바랍니다."
35066,구글,부정,5,2019,4,28,"너무 게임의 본질이 흐려진거아닌가여? 개나소나 대기까고 티밍하고 그와중에 와파문제까지.... 이거는 싸워서 이기는게임이 아니라 대기만 쭉 하다가 마지막아니면 내가 유리한 상황에 나와서 한대 톡 치면 이기는 생존겜이에요. 이건 정말 진심으로 아니라고 생각이 드네요. 또 초 근접케(불, 프리모)가 너무 살기 힘들어졌어요..... 원딜한명 못이기고 같은 근접케인 쉘리도 사정거리때문에 절대 1대1에서는 선빵 아님 못이겨요. 가장 심각한거는 레온..... 너프가 너프가 아닌듯하네요 근접케를 그냥잡고 궁게이지 쉽게차고 이속빠른데 원딜?????!!! 다시한번, 이건 아니라고 생각합니다. 님들...... 제정신이신가요? 저게 캐릭터에요? 지금 1랭크~8랭크사이에는 게임 시작이 안되요. 왜그런지 알아요? 로사때문이에요. 대릴 스타파워 왜있는거죠? 다른캐릭터들이랑 궁, 맵, 모드... 있으나마나 아닌가여? 솔직히 이거 로사스타즈아닌가요? 제발 업뎃은 생각을 하고 하시길 바랍니다. 이건 핵을 만든거임"
35368,구글,복합,5,2019,5,15,진짜 이상하고 이제 거의 망겜입니다 . 이거 하는 것 보다 라이더 하는게 좋을것 같내요. 그리고현질충 만나면 죽은거라고 볼수있네요. 이 게임3대3음 진~~~~~~~~~~~짜로 재미 다운 다운 다운 다운다운다운 되면서가장노잼이고 양각 도 잡히면 10.9.8.7.6등하는게임이고요. 클래시 료얄이 더재미있을거 같습니다. 제가 이 게임 재미있을 것 같았어 깔았는데 정말로 재미가 노잼이내요 그다음에3대3 방금해봤는데 트롤 한 명 나대는 얘 한명이 있었습니다 . 제가 실력이안좋건 인정 합니다 그렇지만 빡겜만되고요 욕나오는 사람도 있고 로사너프 많이많이해주세요. 로사 너무 사기인것 같아요.이거빡겜만되고 즐겜은 안되내요. 개노~~~~~####잼😜이고요.농락도 안되고 제가 놀락 당하내요.이건 망겜 인정 합니까 그럼 전그만 할줄 알았줘이건 악플이 아닌 제가원하는 것 입니다마지막으로한 마디만 하겟습니다.새로운 모드 만들어 주시고요. 좀비모드 같은 거 입니다.그다음에 모 아니면 도는없애주세요.
34773,구글,복합,5,2019,4,28,게임은 재밌어요 그런데 로사로 3대3이나 빅게임 하고 로보럼블이 계속 2/6으로 몇분동안 되서 로사로 쇼다운 밖에 못해요.ㅠㅠ 다른 브롤러로는 3대3이 다되는데 하필 로사만 그래서 로사로 랭크를 못올리겠어요. 저만그러는 건가요? 저랑 똑같으시면 댓글좀요 부탁이에요.갓슈퍼셀님 제발 고쳐주세요. 트로피만 5600이넘는데 로사플레이가 안된다니 그러면 로사로 20랭크도 못올라서 브롤러 랭킹에 못오른단 말이에요. 킹갓엠페러슈퍼셀님 제발 제발 고쳐주세요 간절하게 부탁합니다.😭😢😢😢
34774,구글,부정,5,2019,4,29,진짜 짜증나네요. 스트레스 풀려고 하는건데 스트레스가 더 생기네요. 현질러들만 좋은 캐 많이 갖고 캐릭터 레벨도 높고 3대3 할때는 제 캐릭터 트로피는 300인데 팀원 트로피는 50도 안돼는 거 뭡니까. 슈퍼셀 정신 차리세요. 게임을 이렇게 만들면 싫어하는 사람이 더 많을 겁니다. 패치해 주세요.
34786,구글,부정,5,2019,5,7,브롤을 재밌게 플레이 하는 유저입니다 브롤에 진짜문제는 밸런스 그딴거 필요없고 렉 좀 고쳐줘요. 진짜 와파 3~4칸 뜨는데 레드 와파뜨고 렉 걸리고 트로피 떨구고 아니뭐 1석2조 예요? 이것만 고치만 별 진짜 10000개보다 더 많이 줄수 있어요. 제발 고쳐주세요. 그리고 게임 안하고 잠수타는 사람들 불이익 주세요.
35080,구글,부정,5,2019,4,16,신고기능/채팅기능 추가됬으면 좋겠네요.. 잠수유저 너무많고 고의트롤도 너무많네요...초등학생도 접할수있는게임이다보니 그냥 많이해서 올라가는경우 애들이 너무 못하네요..일부로 가만히 있거나 한두발씩 쏴서 자리비움 탈주 제제안받으려고 하는사람도있으니...대책좀 세워주세요
35085,구글,복합,5,2019,4,29,안녕하세요 브롤스타즈를 즐겨하는 한 유저입니다. 이 게임에서 다른건 다 좋은데...솔찍히 신규 브롤러가 뜰 확륙이 좀.. 아니 그냥 말이 안되요. 솔찍히 현질을 많이할수있는 사람들은 큰 문제가 되진 않겠지만 저같은 무과금 유저나 소과금 유저들은 전설 브롤러를 어떻게 얻으라는건지 모르겠습니다 아니면 그냥 클래시로얄처럼 전설상자를 만들어주세요 아니면 신규브롤러가 나올확률을 조금 올려주세요 제발요..
35398,구글,복합,5,2019,4,20,다 좋은데 매칭에 총 트로피도 반영해야 한다고 생각합니다. 유저의 실력은 그 브롤러의 랭크가 아니라 총 트로피! 1렙 보가 이제 브롤을 시작한 쉘리랑 매칭이 되어서는 안되잖아요. 지금의 매칭시스템이 악용되는 경우도 있고요. 브롤스타즈 업데이트 기대되고 앞으로도 즐겜하겠습니다~
35710,구글,부정,5,2019,5,7,"님들 이겜 절대하지마세요.점수대 좀만 높아지면 현질해서 스타파워가진사람들 막 나오고 3대 3도 매칭이 진짜 뭐 같이되요. 듀오쇼다운 돌리면 혼자 나대다가 계속죽는 팀원이랑 매칭되는게 다반사고 3대 3에서도 랜덤매칭이 점수대 안 맞는 팀끼리 매칭도 많이해요. 상대팀은 전부 9렙, 10렙에다가 브롤러 점수대도 높은데 우리팀은 막 6렙, 7렙짜리들로 매칭되고 트로피 갯수도 100개씩 정도 부족한데, 그게 매칭이되요. 진심, 이거할 바에 차라리 딴 게임을 하시는게 화도 덜나요. 또 솔로쇼다운 시작했는데 갑자기 메인화면으로 튕겨지고 재접속해보면 막 10위, 9위로 되어있고 티밍 방지대책 내놨어도 실질적인 도움은 안 되잖아요. 거기에 진짜 운빨 안 좋은 사람들은 무슨 하지도말라는거예요? 완전 노가다겜이예요. 점수올리는것도, 토큰모아 상자까는것도... 앞서 말했다시피 점수좀만올라가면 스타파워있는 사람들이 많이 나오는데 그에비해 자신은 렙이 넘 낮은거죠. 에휴~"
34791,구글,복합,5,2019,5,19,"제가핸드폰기종이s10e인데요 다른건 다 괜찮은데 쇼다운 모래언덕 만 화면이작아지고 가끔은 오른쪽화면이한2센치정도가 검은색화면입니다. 온전히 제 헨드폰이 이상하다고 말할수없는게 브롤스타즈 젬그렘,바운티 는 운영이잘되고있습니다. 이점 고쳐주셧음좋겠습니다. 이왕이면빠른시일내로... 부탁드립니다! 그럼 이만 꾸벅"
35093,구글,복합,5,2019,4,25,"1. 트롤, 잠수 타는 유저가 많음 한명만 없어도 그냥 겜이 잘 안됨 2. 신고 기능 없어서 제재도 못함 3. 조합운 팀운 운에 의지하는 게임 4. 재미는 있는데 요새 트롤들 때메 듀오 아님 안하게 됨 5. 나사 적팀 옆에만 떨어져서 역전패 오지게 나옴 이거 은근 개빡침... 😠 6. 브롤러 솔직히 등급 이런거 밸런스가 잘 안맞음 제시, 샐리 등만 쓰게됨"
35402,구글,복합,5,2019,5,19,브롤스타즈 6개월정도 한 유저입니다 제가 힘들게 5500점을찍고 어렵게 더 올리고있는 중에 너무 어이없는 일이 발생했습니다 시즈팩토리라는 맵에서 제가 랜덤큐를 돌렸는데 하는 판마다 팀원이 트롤을 하거나 게임에서 나가거나 하는 분들때문에 트로피가 많이 떨어지게 되었습니다. 팀운이라는 것이 안 좋을 수도 제가 못해서 질수도 있다고 생각합니다. 하지만 게임이라는게 즐기기 위해서 하는 건데 항상 지고 트로피가 떨어지게 된다면 이 게임의 재미를 못 느끼고 그만두게 될수도 있겠죠 저는 개인적으로 브롤스타즈 이 게임을 좋아하는 편이라서 이런것 때문에 접고싶지는 않습니다
