ID,STORE,LABEL,SCORE,YEAR,MONTH,DAY,CONTENTS
37824,구글,부정,5,2019,4,25,아니 이게 말이되???팀이 못하면 내 트로피도 내려가는데 왜 신고버튼이 없어??설마 팀이 혼나기 싫어서 그런거야??!!그리고 전설캐가 왜 기본 쉘리한테저???실화냐 그것도 전설이???또 렉이 왜이렀게 걸려!!!렉걸려서 게임을 못하겠다😠😠😠😡😡렉좀 고치라 슈퍼셀
37831,구글,긍정,5,2019,4,28,"안녕하세요.저는그냥이게임을즐기는닌겐입니다. 게임은하다가 갑자기로사라는브롤러가나오고, 전설이든다필요가없어졌어요.쇼다운은다로사로정복되었습니다.그래서말하는데로자좀....너프해주세요."
37834,구글,복합,5,2019,5,8,정말 재밌게 게임하고있습니다 다만 한가지 있으면 좋겠다하는생각인데요 올라인플레이어 뜨는거에 온라인 플레이어 팀 채팅창 클업채팅창이있잖아요 그거 온라인플레이어를 친구랑 길드랑 나눠서 볼수있으면 좋을거같아요 저 혼자만의 생각입니당
37836,구글,긍정,5,2019,4,29,"브롤은 정말 갓 겜입니다. 그런대 제 폰에서 젬그랩 카운트다운,전투 시작음이 나오지 안습니다.그것만 고쳐주시면 정말 감사하겠습니다. 앞으로도 계속 업데이트 많이 해주세요.감사합니다."
37837,구글,복합,5,2019,5,19,다 좋은데 저기 슈퍼셀 직원 분들.. 시즈 팩토리 트로피 너무 많이 떨어집니다.. 15랭크부터 10개 떨구고.. 14랭크는 8개 떨구고.. 이 사항만 고쳐주고 또 브롤러 확률 신화브롤러 0.4678 정도만 해주세요.. 확률 ㄹㅇ 극악인 듯..
37538,구글,부정,5,2019,5,18,슈퍼셀 게임 애용가 이지만 매번 느끼는건데 게임은 잘 만드는데 슈퍼셀 게임 전통인지 신고 기능이 없는게 불편함 팀게임을 하면 꼭 일부로 고의적 트롤링이나 티밍 그리고 페널티를 받지 않을 정도로 움직이면서 교묘하게 피해나가는데 신고 기능과 이런 관리 시스템 좀 구축해주세요
37843,구글,복합,5,2019,4,20,저는 브롤을 즐기고 있는 유저입니다 캐릭터도 다양하고 맵도 많아서 좋지만 다른게임들처럼 출석보상이 없는게 아쉽습니다. 그리고 티밍을 하는 유저들이 자주보여서 게임을 하기가 불편합니다. 그리고 스킨이 없는 캐릭터의 스킨도 만들어주시면 감사하겠습니다~^^
38143,구글,복합,5,2019,5,21,정말 최고의 게임입니다. 근데 좀 게임모드가 다양해지고 트로피를 이르지 않으며 친선전 같지만 다른 온라인 플레이어를 만날수 있는 기능이 있으면 좋겠습니다.그리고 친선전에 봇 없이 등의 옵션을 더하면 좋겠습니다.
38147,구글,복합,5,2019,4,27,로사가 너무사기에요 너프좀해주새요 게임을 못하겠어요. 그리고 내트워크가 우라집은 잘돼요근데 게임에서 렉이너무심하고 도저이 못참겟어요 게다가 티밍까지(절래저래)로사가 왠3명이냐고!이러게 말해요진짜 신고기능은왜안만드러 만드는거야! 진짜
38149,구글,부정,5,2019,4,19,쇼다운을 플레이 할 때마다 저만 늦게 시작되는 오류가 발생합니다. 그래서 시작하면 게임 오버가 되어있는 경우가 많습니다. 이런 일만 없으면 이 게임은 최고 겠네요.
38151,구글,부정,5,2019,5,11,티밍 고치기 전까진 근거리 브롤러들+셸리는 못쓸것같네여 그리고 겜 만들거면 시스템부터 제대로 다시 만드세요. 티밍때문에 재밌던 겜도 정떨어지고 겜할때마다 화나기만 하네여 이런식으로면 브롤스타즈 팬층들 많이 떠납니다 그리고 티밍신고 시스템이나 티밍하는 유저들 벤하는 시스템을 만들기라도 진짜 최근들어 천상계가면 갈수록 좀 많이 실망하네요..
37552,구글,부정,5,2019,4,28,와우 이런게임은 처음이다 난 방금시작 했을때 3000트로피를 만났다 하...그대다 쉘리는 공격3번 정도만하면 궁차는건 뭐지? 그리고 분명 와이파이 공유기 앞에서 겜하는대 와이파이 끊기내 아...왜 교전상황에만 그러지 렉때문에 쉘리로 발리도 못이겨 하...난 클로나 할란다...
37553,구글,복합,5,2019,5,2,"아.. 진짜 잘만들었엉ᆢ👏🖒 그 옛날에 제가 브롤을할려고 했는데 브롤이 지워진 거예요!(그때가전설있고, 신화 있었던때1000트로피)전 다시 깔았는데.. 처음부터 다시 시작인 거예요! 그래서 전 믿기지 않아 다시 지우고 다시한번 더 깔았죠(속마음 : 하나님 부천님 세계의 있는 모든 신 그리고 갓퍼쉘님이여! 제발 제 계정을 주세요ㅜㅜ) 근데 제 소원이 이루워 진 것마냥 제 계정으로 돌아왔죠.. ㅜㅜ 그래서 지금은 잘 플레이 하고 있습니당 여러분들도 조심😜😜"
37558,구글,복합,5,2019,4,16,역시 브롤스타즈~완벽한 갓겜이네요.하지만 이것만은 말씀 드리고 싶어요. 1.신고기능 추가 2.스토리 모드 추가 3.10레벨당 한번씩 이름을 바꿀수 있으면 좋겠습니다.만약 된다면 너무너무 감사드립니다.
37560,구글,복합,5,2019,5,7,다좋습니다만 잠수타는 중국 핵유저가 많네요. 랜덤매치도 억울한데 신고 차단도 없다니. 매치에 중국어뜨면 그냥 탈주합니다. 해도 되는게 없거든요. 트로피 깎이는것도 화나는데. 다른 버그는 다 참아도 이건..못 참겠어요
37872,구글,복합,5,2019,5,3,"게임은 정말 잘 만들었습니다. 그래서 저도 재밌게 하고 있고요. 근데 로사는 왜 만들었어요? 안그래도 벨런스 좋다고 말할 수 없는 게임인데 대놓고 로사라는 사기캐 출시하고 너무쌔다 너무쌔다 하니까 궁극기를 너프하기는 했는데, 로사의 근본적인 문제점을 모르신다는건 좀 너무하지 않나요? 그리고 사기케 뒤에는 쓰래기도 있듯이, 너무 않좋은 캐릭터들은 아예 손을 안보는 건가요? 암튼 말이 좀 길었는데, 요약하자면 벨런스만 좀 제대로 조절해주시면 좋겠네요"
37878,구글,부정,5,2019,4,29,"서버 관리 이따구로해서 맨날 와이파이 불안정적이다는 그딴 소리만 할거면 게임장사를 하지마 추가로 수정할게 신캐나오고 게임물 개더럽다 니네는 시뮬레이션도 안하고 신캐릭터 내냐? 무슨 내가 로사로 게임할려하면 큐도 안잡히는데 다른 캐릭터로 게임하면 우리팀에는 로사 없고 적팀에만 로사 있는건 먼데? 진심으로 클로도 그렇고 제작자가 쓰는 카드만 버프시키고 카운터는 너프시키는 이딴 소문 안 믿었는데, 믿음이 지금은 아예 바닥이다 진짜 정신좀 차리고 운영하자 제발"
38161,구글,부정,5,2019,5,19,이게 티밍이 개선된건가요? 장난해요? 19랭큰데도 티밍이 너무많네요. 그리고 레온 너프좀 더 해주세요. 로사도요. 로사.레온 둘이서 쇼다운 다해먹는데 다른캐릭은 어쩌라고요. 덕분에 슈퍼셀 손절각 보이네요.
38166,구글,부정,5,2019,4,28,진짜 최악게임 입니다 아니 신케 데미지하고 궁극기 상태 왜이러는데? 그리고 내가 운이 안좋다 해도 내친구 들는 현질 안하고 좋은거 뽑는데 나만 현질을 해도 내가 가지고 싶은 캐릭터는 안나오고 있는거만 오지게 나오니까 내친구도 빡쳐서 게임 삭제합니다 그니까 패치도 제대로 하삼 게임 망하기 싫으면요 진짜 패치 될때까지 기대 하고 있을게요 수고하십쇼
38167,구글,긍정,5,2019,4,28,"초딩게임 이지만 은근 재미있고 약간 배그와 옵치,롤느낌이 있어서 너무나도 재미있어습니당~~~♡♡♡(그리고 트롤러들과 핵쟁이 티밍러들 등등 다 처단해주시면 감사 드리겠습니다!!!!!!)"
38168,구글,부정,5,2019,4,27,네 드디어 3600찍고 영웅이 뜨네요... 인내심으로 버텼는데 이거 문제가 다시 많아졌네요... 일단 로사를 너프를 부탁합니다 이것으로 클래시 로얄처럼 브롤이 망할까 걱정이네요 그리고 신고기능을 추가해 주세요
37269,구글,복합,5,2019,5,7,안녕하세요 브롤스타즈 재밋게 하고있는 유저중 한명입니다 맵도 재밋고 캐릭터도 너무 멋있어서 재밋는데 하고있는도중에 와이파이 그림이 뜨면서 플레이에 지장이 생깁니다 와이파이 문제인줄 알고 와이파이를 봐꿔봐도(게임때문에 바꾼게 아니라 바꿀때도 됬고해서 바꾼겁니다)계속 와이파이그림이 뜨면서 플레이에 지장이생깁니다 이부분만 개선해주시면 좋겠습니다 답변남겨주세요.
37568,구글,부정,5,2019,4,27,진짜 로사 한번붙으면 무한으로 궁써가면서 때리는데 이게 과연 정상적인 게임 진행이라고 생각하시는지... 로사 밸붕 너무 심하고 그냥 이기고 지고를 떠나서 판에 로사 보이기만 해도 게임 하기 싫어지네요 걍 게임 삭제합니다.
37569,구글,부정,5,2019,5,5,아니... 게임이 아닌거 같아요 트로피 엄청 떨어진다고요 렉 해결 언제쯤 하실거죠? 브롤 접기 일보 직전이네요 제발 서버관리 좀 하세요;;;;; 떨어진 트로피들 어쩔거에요 시작하자마자 렉 걸리고 도중에도 렉 걸리고 쇼다운은 시작하면 상자도 못 먹고 먹은 애한테 바로 죽고 신캐 스킨 업데이트 생각하기전에 서버관리 먼저 하세요 다른것들은 렉 1도 안 걸리는데ㅡㅡ 폰 기종은 갤럭시 jean입니다 제발 렉 현상 좀 고쳐주시죠 렉 좀 고치라고요! 진짜 트로피가 얼마나 떨어지는거야 하
37571,구글,복합,5,2019,5,18,브롤스타즈는 충분이 재미있고 좋습니다 하지만 이제 상점에 전설을 막 파네요? 물런 저도 전설이 본개정에 있지만 무 현질러는 절설을 못뽑을스도있고 마냑에 돈이있어도 400보석이 넘는 거면 한6만원도인가? 그정도로 바사게 하네요 저도 기프트 카드를 사서 할라고 했는데 거이 못사네요 마냑에 보신다면 참고하면 좋겠음니다 수퍼셀님들 레온이 나왔을때 상점에 떴지만 무련질러는 거이 못사는 정도에 보석으로 나왔죠 게임을 돌리니 다 리온인적도 있음니다 레온이 사기가 아니라면 불만이없지만 너무 사기였고 이제는 너프 당했지만 손해본사람도 오늘 본게 진짜라고 믿을수 없음니다. 상점에 전설 스파이크레온크러우 다 떴네요? 이건 현질 하라는거잔아요이제 현질한사람은 다 전설갇고 무현질러는 당하기만 하고 그렇다고 절설이 무조건 이기는건 아님니다 하지만 레어 희기 초희기 보단 좋죠 3번째로 티밍임니다 이건슈퍼셀도 조치를 취했지만치유버선이나 운석이 안나오는듀오에는어떻하죠?말할게 더많지만제한때문에여기서끝네겟음니다.
37271,구글,부정,5,2019,4,28,"브롤스타즈를 하는 플레이어 입니다. 제가 하면 토큰을 얻어서 상자를 열수있는데 희귀,초희귀,영웅,신화,전설이 나올 확률이 비슷한데 왜 전설은 안나오죠?? 그리고 로사 너무 사기입니다. 특수공격을 하더라도 300닳으면 인정하겠는데 135인가 밖에 안 닳아서 조금 방어력을 약하게 해주셨으면 좋겠는데..."
37273,구글,복합,5,2019,5,4,아니 내트로피 8000이었는데 100개 됨 다시트로피 8000개로올려주세요ㅠㅠ 그리고 레온 없어짐 버그 없에주세요 ㅠㅠ제발 근데 재밌음 그리고 보석이 394개 에서 3개가 됬어요 그점도 다시 제 보석 돌려쥬세요 제발요ㅠㅠㅠㅠㅠㅠㅠㅠㅠㅠㅠㅠㅠㅠㅠㅠㅠㅠㅠㅠㅠㅠㅠㅠ
37275,구글,긍정,5,2019,5,6,아니이거 진짜 너무한거아니냐구요 만 이천원 현질 했는대 버그걸려서 나가지고는 코인이랑 보석만주고는 매가상자2개주는건대 ㅠㅠ ㄴ나가져 지고 다시 켰는대 매가상자2개가 없어져가지고 진짜 억울해가지고 😭 별 3개를 주었습니다. 이유는 이개임 너무너무 재미있어요 아무리 억울해도 이개임은 너무너무 재미있어요💕 재작자님 더더더더더더더더 재미있는 업대이트 부탁해요~~~ 그리고 전설 유닛더 늘려주세요 스파이크랑 레온 크로우 만 있잔아요 재작자님 이거 일어주세요
37281,구글,부정,5,2019,5,7,아니 개판이야 최적화 부족 잦은 와이파이표시 개판 밸런스 ㅋㅋㅋ ㅋㅋㅋㅋ 좋은게없눈데 패치를 좀 하세요 예? 그리고 고의적으로 트롤짓 하는 애들 신고도 못해 ㅋㅋㅋㅋ 배그모바일 초기보다 심각한뎈ㅋ 그리고 게임자채가 재미있지보다 짜증남 스트레스만 받음 울뻔 별1개도 아까움 플레이스토어에서 내리셈;;
37587,구글,부정,5,2019,4,21,하....이건 망겜이에요 상대팀은 잘하는 사람만나고 울팀은 겁나 못하는 사람 만나고 이건 패치가 되야한다고 생각해요 힘들게 올린 트로피인데 트로피 떨어지거나 브롤러 트로피가 400이 넘는데 200으로 떡락 하는 기분을 헤아리세요. 제발 이점을 고쳐주세요 안고치잖아요? 이 게임 접고 친구들사이에서 전부 지우라고 할거에요 이거 고치세요~^^7
37900,구글,복합,5,2019,5,11,게임을 즐기는 6학년 학생입니다. 게임에서 다양한 모드도 재미있고 다양한 브롤러의 개성이 강해 재미있게 즐길 수 있습니다. 하지만 현질러들이 랜덤매칭에서 속속이 등장하여 지기만 하는 상황이 나오네요. 전설•신화 브롤러 너프 부탁드립니다.
37904,구글,부정,5,2019,4,19,이번 업데이트하고 최초 접속시 로딩후 시작화면 나옴과 동시에 튕기고 두번째 접속부터 정상적으로 접속이되는데 수정좀 해주세요 저만이러는게 아닙니다. 게임자체는 만족스럽게 잘하고있어요
37303,구글,부정,5,2019,4,28,"안녕하세요, 브롤러 입니다 로사 패치좀 부탁드립니다. 빅 게임에서 로사가 빅 브롤러 되면 2분 훌쩍 넘겨서 지계 됨니다. 궁 게이지만 패치해 주시면 밸런스도 맞게 될껍니다. 고쳐주세요. 고쳐주시면 감사하겠습니다."
37599,구글,부정,5,2019,4,30,게임은 정말재밌어서 항상 2시간훌쩍보내는데 하나마음에 걸린다면 브롤스타즈는 WIFI로는 게임이안되나요...? 항상 WIFI로 게임을 실행하면 인터넷연결이 잘안됬다는표시뜨면서 끊김현상이 매우심해서 모바일데이터로 게임을 플레이하고있습니다. 그래서 데이터를 다쓰면 다시 데이터가들어올때까진 게임을 플레이하지 못하네요 ㅠㅠ 고쳐주세요 이부분때문에 게임을플레이하다가 끊김이너무심해 움직이지도않고 공격도안되서 게임이 되고있는지도 모르다가 점수가 깎여버리네요... 이점빼곤 모든게 마음에 들정도로 확실히 재밌는 게임이네요. 하루라도 빨리 이점에대해 검토하며 고쳐줬으면 바램이큰데 요번에도 똑같은현상으로인해 점수가 깎여서 이참에 말씀드립니다. 부탁드립니다.
37600,구글,부정,5,2019,4,17,아니 업대이트가 됬으면 드러가져야지 드러가지지는 않고 중지가 당해요 장난합니까? 게임이 업데이트 되면 버그나 그런것들이 없어져야지 더 생기고 있네요. 트로피가 1000개가 다되가는데 삭제를 해야되니 짜증이 나네요 다음 업데이트에 게임 할수있게 해주세요
37602,구글,복합,5,2019,4,23,다좋은데 업데이트 이후 처음 접속시 로딩 후 한번씩 팅깁니다(갤럭시 s10플러스) 아직 최적화가 덜된듯..대기화면에서 배경화면이랑 왼쪽상단 프로필버튼이랑 화면크기도 안맞아요 업데이트부탁드려요
37605,구글,부정,5,2019,5,7,"노트9 사용자인데요. 현재 브롤스타즈를 플레이하려고 어플실행 시키면 메인 화면에서 멈추고 어플이 강제종료 되고, 다시 어플을 실행시키면 작동됩니다. 한번이 아니라 처음 어플을 작동시킬때면 계속 이런 현상이 나타나네요."
37606,구글,부정,5,2019,5,6,개 *발 같은. 첫구매랑 보석으로 메가상자 4개깠는데 *같은 대릴 하나 나온거 실화냐? 갖고있는게 기본밖에 없는데. 이 병*같은 새*는 궁극기라고는 개*같은 효율에 총을 쏘는건지 구슬을 날리는건지 구분안가는 딜량에. 보석 30개로 산 포코가 훨낫다 시*새*들아. 현질유도 작작해야지 어지간한 겜창아니면 트로피 2천개는 가겠냐? 돈아깝다 시* 트로피 1천개로 나온 브록이라는 등*은 뭐야. 3대3할때 이걸 제대로 하는 새*를 본적이 없어 허공에 쳐날리기만 하는 멍청한 캐릭에. 보석 10개 다됐으면 후퇴하지 뭘 *나 죽이고 싶다고 쳐가서 죽는 *끼들은 대체 뭐냐? 축구할때 자살골 넣는 뇌가 해파리무침같은 애들은 뭐냐? 쇼다운해서 트로피 올리면 뭐하냐? *발
37609,구글,복합,5,2019,5,16,아니 게임은 다좋은데 제발 팀좀 어떻게 해주면 안될까요? 5판을 해가지고 다졌으면 AI라도 좀 나와야 하는거 아닌가요? 전판에 같이 해서 진사람은 질하는사람 만나서 이기는데 제 팀은 그냥 그레가지고 진짜 욕하면서 했는데 이거좀 어떻게 해주세요 점수대랑 파워좀 맞춰주시던가 부탁드립니다.
37308,구글,부정,5,2019,4,27,밸런스 조정되면서 신캐 나오니까 밸런스 체계가 아예 무너지네요.. 풀강 로사 혼자서 3대1을 이기면 어찌 플레이 하라는 것인지요.. 타격 횟수를 줄이거나 특수 기술 충전량을 줄이거나 데미지를 줄이거나 공격 범위를 줄이거나 이 중에 1가지는 꼭 조정해주셨으면 합니다 스파이크랑 쉘리가 같이 덤비는데도 이기고 크로우 독침 맞았는데 오히려 체력이 오르면 이게 밸런스가 말이 됩니까?
37311,구글,부정,5,2019,4,18,아니 어떻게 와이파이가 안통해요 그리고 짜쯩 나고 트로피 떨어져서 짜증나 죽겠네 그리고 오늘은 와이파이가 안 통 해요 알겠냐?! 그래 가지고 게임을 어떻게해 #%#%#%^~#%#%^~^%##%#*#*****##*^**#*^알겠냐?! 슈퍼셀
37316,구글,부정,5,2019,4,22,아니 와이파이 연결된 상태에서 게임 안되게 하는건 일부러 그런건가요? 다돌아가는데 이게임만 와이파이 연결하면 안되면 폰이 문제가 아니라 게임 문제 아닌가요?? 좀 관리좀 하세요 광고만 하지말고;
37615,구글,복합,5,2019,5,6,다른 건 다 좋은데 맨 처음 시작할 때 튜토리얼 건너뛰기 같은 거 있었으면 좋겠네요. 건너뛰기 버튼 같은 게 없으니까 나중에 삭제 했다가 다시 설치해서 시작하려면 또 튜토리얼 다시 해야해서 이미 브롤스타즈 조작법을 아는 유저들에게는 지루한 시간을 가지게 될 것입니다. 그래서 다른 슈퍼셀 게임들처럼 건너뛰기를 만들어줬으면 좋겠습니다.
37328,구글,부정,5,2019,4,16,"여기 에 부정적 평점 다신분들 캐릭터 확률이나 렉문제, 티밍 관련해서 리뷰 다신것 같은데,캐릭터 확률은 원래 확률이 메가상자에서도 영웅 등급부터 확률이 약 0.5%로 떨어지고요 신화와 전설은 이보다 더떨어지기 때문에 당연히 나오기 힘들수밖에 없습니다. 그리고 렉문제는 와이파이가 잘된다면 폰이 문제니까 폰바꾸시면 될것같구요,티밍관련은 4월 업데이트 관련 일상에서도 보셨다시피 이제 고쳐지고 있습니다. 만약 이래도 꼬우시다면은 슈퍼셀 입사하세요 ㅋ"
37334,구글,부정,5,2019,5,9,"안녕하세요~저는 브롤 스타즈 재밌게 플레이 하는 유저입니다.제가 리뷰 남기는 이유가 신화,전설브롤러가 나오지않아서입니다.주변 친구는잘 나오고 심지어 오늘 우리형이 모티스를 뽑았고 2000트로피도 되지않는데 크로우 레온이 있어서 입니다. 타라,스파이크나와라!!!!!"
37045,구글,부정,5,2019,5,1,아니 토큰더블러를 구매도 누르지않았는데 갑자기 50보석이 나가요. 진짜 슈퍼셜 미친거 아니에요? 저이러려고 현질한거 아니에요. 아니 진짜 강제 구매 실화에요? 빨리 환불해주세요. 이거 보지도 않는거 알아요. 그래도 이것때문에 돈을 얼마나 질렀는데 장난해요? 이거 강제 구매때문에 따른 친구들도 피해많이봤어요. 어떤 애는 6달치 용돈 날아갔다고요. 환불안해주면 슈퍼셸 인성 파탄각입니다. 내가 참다참다 이거 올립니다. 요즘 보석모으기도 힘든데 50보석 제가 3달넘게 해서 얻은 거에요. 빨리 환불 부탁합니다
37053,구글,복합,5,2019,4,20,"이렇게 좋은 게임을 만들어 주셔서 감사합니다!근데 스킨이 많이나오는 캐릭터만 많이나오는 것 같아요...많이 안나오는 캐릭터들도 많이 나오게 해주세요!(예를들어 페니,파이퍼,레온 등등!)"
37347,구글,복합,5,2019,5,16,재밌고 저 진계정에 레온있음 전설나올때 두근두근 합니다 정말 재밌습니다 하지만........... 레드 와이 파이때문에 렉...... 이 심해요 암튼 재밌어요 정말 잘만들었어요 제작자님 아이디어가 좋으시네요 다른 브롤러 전설한 1개만 더 나오게 해주세요..............암튼 이만 ....
37358,구글,복합,5,2019,5,14,게임 자체가 너무 재밌는데 브롤스타즈를 한번 지웠다가 까니까 활동했던 플레이 기록은 없어졌는데 클랜에는 아직도 전 계정이 남아있습니다.. 클래시로얄은 구글연동이 처음 깔자마자 바로 나와서 좋았는데 브롤스타즈도 그랬으면 좋겠네요..
37359,구글,복합,5,2019,4,29,이게임 자체는 너무 재밌습니다. 운영이라던가 게임방식이라던가 캐릭터 각각의 독창성이라던가 이는 칭찬해줄만합니다. 근데 밸런스 문제가 심해요 ㅎㅎ. 특히이번 신캐는 그냥 전설로주시지왜 희귀로 넣으셨는지이해가안가요. 상점에서 보석19개주고 살만한게 아니던데요 ㅎㅎ. 레전드가왜 레전드캐릭인지도 모르겠구요 지금 1렙들 쇼다운 들어가보세요. 3000점뜨고 얻은 보로 쇼다운돌리는데 전부 신캐에요. 그냥 만나기만하면 털리죠 ㅋㅋ 하다못해 엘프리모도 그냥 녹고 그궁은 무한궁입니까???ㅋㅋㅋㅋㅋ아니 어이가없어서 궁쓰면그냥 무적이야 이러면 레온이나 다른애들 궁은 쓰레기 되는거에요 ㅋㅋㅋ. 그리고 쇼다운 맵도 보세요. 들어가보면 10중 67은 불아니면 셸리야. 전부그냥 샷건만 써요 ㅋㅋㅋㅋ 맵도 밸런스엉망이고 이번신캐패치도그렇고... 조금만 수정해주신다면 정말 즐겁게플레이할수 있을것 같아요.
37360,구글,부정,5,2019,5,12,와이파이가 잘 터지는데도 안터지고 렉이걸리네요 그리고 게임플레이를 못할정도 까지 빨간 와이파이 표시가 떠서 게임이 계속 렉이 걸립니다 그래서 이 문제점 하고 신고버튼좀 만들어 주셨으면 하겠습니다 왜냐하면 트로피 점수가 올라갈수록 동맹을 해서 우승을 차지하는 사람들이 갈수록 많아집니다 그래서 저는 계속 지고 트로피까 많이 깍였습니다 그래서 신고버튼을 만들어 주셨으면 합니다 아니 좀 이런 문제점을 빨리좀 고쳐라
37059,구글,부정,5,2019,4,17,총3가지문제점이있습니다 1.개인폰문제인지는모르겠지만 어느순간부터 게임접속하려고 어플실행하면 꼭2번만에접속되는경우가있구요.재설치했습니다 2.고질적인문제 와이파이연결불안정 간헐적으로 연결끊깁니다 3.트롤및 방관 신고기능이생겼으면좋겠네요 전체적으로 게임성은 아주좋습니다 잘이끌어가시길
37364,구글,긍정,5,2019,4,27,완전 완전 완전 완전 완전 완전 완전 완전초대박으로 말로포현 할수없을만큼 별로내요.처음이라서그런가봐요 아무리 처음이레도 완전별로예요.반의 반의반이라는 평가도 있있었으면좋겠어요.이렇게긴 댓글을 단건 처음이네요.
37368,구글,긍정,5,2019,5,17,왜저만 지는거에요전설코드도100번이나해도안되겟다이유가있어요!?슈퍼셀님재미있고정확하게게임을만들어야죠저트로피2000이었는데294로떨어졋잔아요!!!!!!!!!!!다시게임만들세요💢
